,DRG,CM-PCS,en
5990,DRG07906,A481,Legionnaires' disease
5991,DRG07906,J150,Pneumonia due to Klebsiella pneumoniae
5992,DRG07906,J151,Pneumonia due to Pseudomonas
5993,DRG07906,J1520,"Pneumonia due to staphylococcus, unspecified"
5994,DRG07906,J15211,Pneumonia due to Methicillin susceptible Staphylococcus aureus
5995,DRG07906,J1529,Pneumonia due to other staphylococcus
5996,DRG07906,J155,Pneumonia due to Escherichia coli
5997,DRG07906,J156,Pneumonia due to other aerobic Gram-negative bacteria
5998,DRG07906,J158,Pneumonia due to other specified bacteria
