DRG,CM-PCS,en
DRG08706,J951,Acute pulmonary insufficiency following thoracic surgery
DRG08706,J952,Acute pulmonary insufficiency following nonthoracic surgery
DRG08706,J953,Chronic pulmonary insufficiency following surgery
DRG08706,J95821,Acute postprocedural respiratory failure
DRG08706,J95822,Acute and chronic postprocedural respiratory failure
DRG08706,J9610,"Chronic respiratory failure, unspecified whether with hypoxia or hypercapnia"
DRG08706,J9611,Chronic respiratory failure with hypoxia
DRG08706,J9612,Chronic respiratory failure with hypercapnia
DRG08706,J984,Other disorders of lung
