DRG,CM-PCS,en
DRG17937,K5100,Ulcerative (chronic) pancolitis without complications
DRG17937,K51011,Ulcerative (chronic) pancolitis with rectal bleeding
DRG17937,K51012,Ulcerative (chronic) pancolitis with intestinal obstruction
DRG17937,K51013,Ulcerative (chronic) pancolitis with fistula
DRG17937,K51014,Ulcerative (chronic) pancolitis with abscess
DRG17937,K51018,Ulcerative (chronic) pancolitis with other complication
DRG17937,K51019,Ulcerative (chronic) pancolitis with unspecified complications
DRG17937,K5120,Ulcerative (chronic) proctitis without complications
DRG17937,K51211,Ulcerative (chronic) proctitis with rectal bleeding
DRG17937,K51212,Ulcerative (chronic) proctitis with intestinal obstruction
DRG17937,K51213,Ulcerative (chronic) proctitis with fistula
DRG17937,K51214,Ulcerative (chronic) proctitis with abscess
DRG17937,K51218,Ulcerative (chronic) proctitis with other complication
DRG17937,K51219,Ulcerative (chronic) proctitis with unspecified complications
DRG17937,K5130,Ulcerative (chronic) rectosigmoiditis without complications
DRG17937,K51311,Ulcerative (chronic) rectosigmoiditis with rectal bleeding
DRG17937,K51312,Ulcerative (chronic) rectosigmoiditis with intestinal obstruction
DRG17937,K51313,Ulcerative (chronic) rectosigmoiditis with fistula
DRG17937,K51314,Ulcerative (chronic) rectosigmoiditis with abscess
DRG17937,K51318,Ulcerative (chronic) rectosigmoiditis with other complication
DRG17937,K51319,Ulcerative (chronic) rectosigmoiditis with unspecified complications
DRG17937,K5140,Inflammatory polyps of colon without complications
DRG17937,K51411,Inflammatory polyps of colon with rectal bleeding
DRG17937,K51412,Inflammatory polyps of colon with intestinal obstruction
DRG17937,K51413,Inflammatory polyps of colon with fistula
DRG17937,K51414,Inflammatory polyps of colon with abscess
DRG17937,K51418,Inflammatory polyps of colon with other complication
DRG17937,K51419,Inflammatory polyps of colon with unspecified complications
DRG17937,K5150,Left sided colitis without complications
DRG17937,K51511,Left sided colitis with rectal bleeding
DRG17937,K51512,Left sided colitis with intestinal obstruction
DRG17937,K51513,Left sided colitis with fistula
DRG17937,K51514,Left sided colitis with abscess
DRG17937,K51518,Left sided colitis with other complication
DRG17937,K51519,Left sided colitis with unspecified complications
DRG17937,K5180,Other ulcerative colitis without complications
DRG17937,K51811,Other ulcerative colitis with rectal bleeding
DRG17937,K51812,Other ulcerative colitis with intestinal obstruction
DRG17937,K51813,Other ulcerative colitis with fistula
DRG17937,K51814,Other ulcerative colitis with abscess
DRG17937,K51818,Other ulcerative colitis with other complication
DRG17937,K51819,Other ulcerative colitis with unspecified complications
DRG17937,A400,"Sepsis due to streptococcus, group A"
DRG17937,A401,"Sepsis due to streptococcus, group B"
DRG17937,A408,Other streptococcal sepsis
DRG17937,A409,"Streptococcal sepsis, unspecified"
DRG17937,R6510,Systemic inflammatory response syndrome (SIRS) of non-infectious origin without acute organ dysfunction
DRG17937,R6511,Systemic inflammatory response syndrome (SIRS) of non-infectious origin with acute organ dysfunction
DRG17937,R6520,Severe sepsis without septic shock
DRG17937,A412,Sepsis due to unspecified staphylococcus
DRG17937,A4101,Sepsis due to Methicillin susceptible Staphylococcus aureus
DRG17937,A4102,Sepsis due to Methicillin resistant Staphylococcus aureus
DRG17937,A411,Sepsis due to other specified staphylococcus
DRG17937,A403,Sepsis due to Streptococcus pneumoniae
DRG17937,A414,Sepsis due to anaerobes
DRG17937,A4150,"Gram-negative sepsis, unspecified"
DRG17937,A413,Sepsis due to Hemophilus influenzae
DRG17937,A4151,Sepsis due to Escherichia coli [E. coli]
DRG17937,A4152,Sepsis due to Pseudomonas
DRG17937,A4153,Sepsis due to Serratia
DRG17937,A4159,Other Gram-negative sepsis
DRG17937,A4181,Sepsis due to Enterococcus
DRG17937,A4189,Other specified sepsis
DRG17937,A419,"Sepsis, unspecified organism"
DRG17937,E440,Moderate protein-calorie malnutrition
DRG17937,E441,Mild protein-calorie malnutrition
DRG17937,E45,Retarded development following protein-calorie malnutrition
DRG17937,E46,Unspecified protein-calorie malnutrition
DRG17937,E640,Sequelae of protein-calorie malnutrition
DRG17937,K561,Intussusception
DRG17937,K560,Paralytic ileus
DRG17937,K567,"Ileus, unspecified"
DRG17937,K562,Volvulus
DRG17937,K5649,Other impaction of intestine
DRG17937,K563,Gallstone ileus
DRG17937,K5641,Fecal impaction
DRG17937,K565,Intestinal adhesions [bands] with obstruction (postprocedural) (postinfection)
DRG17937,K5669,Other intestinal obstruction
DRG17937,K5660,Unspecified intestinal obstruction
DRG17937,K603,Anal fistula
DRG17937,K604,Rectal fistula
DRG17937,K605,Anorectal fistula
DRG17937,K632,Fistula of intestine
DRG17937,K920,Hematemesis
DRG17937,K921,Melena
DRG17937,K922,"Gastrointestinal hemorrhage, unspecified"
DRG17937,R000,"Tachycardia, unspecified"
DRG17937,R002,Palpitations
DRG17937,R010,Benign and innocent cardiac murmurs
DRG17937,R011,"Cardiac murmur, unspecified"
DRG17937,R008,Other abnormalities of heart beat
DRG17937,R009,Unspecified abnormalities of heart beat
DRG17937,R012,Other cardiac sounds
DRG17937,I96,"Gangrene, not elsewhere classified"
DRG17937,R579,"Shock, unspecified"
DRG17937,R570,Cardiogenic shock
DRG17937,H49811,"Kearns-Sayre syndrome, right eye"
DRG17937,H49812,"Kearns-Sayre syndrome, left eye"
DRG17937,H49813,"Kearns-Sayre syndrome, bilateral"
DRG17937,R571,Hypovolemic shock
DRG17937,R578,Other shock
DRG17937,R6521,Severe sepsis with septic shock
DRG17937,R590,Localized enlarged lymph nodes
DRG17937,R591,Generalized enlarged lymph nodes
DRG17937,R599,"Enlarged lymph nodes, unspecified"
DRG17937,R0989,Other specified symptoms and signs involving the circulatory and respiratory systems
