DRG,CM-PCS,en
DRG10107,T270XXA,"Burn of larynx and trachea, initial encounter"
DRG10107,T271XXA,"Burn involving larynx and trachea with lung, initial encounter"
DRG10107,T272XXA,"Burn of other parts of respiratory tract, initial encounter"
DRG10107,T273XXA,"Burn of respiratory tract, part unspecified, initial encounter"
DRG10107,T274XXA,"Corrosion of larynx and trachea, initial encounter"
DRG10107,T275XXA,"Corrosion involving larynx and trachea with lung, initial encounter"
DRG10107,T276XXA,"Corrosion of other parts of respiratory tract, initial encounter"
DRG10107,T277XXA,"Corrosion of respiratory tract, part unspecified, initial encounter"
