,DRG,CM-PCS,en
180,DRG14903,0DY80Z0,"Transplantation of Small Intestine, Allogeneic, Open Approach"
181,DRG14903,0DY80Z1,"Transplantation of Small Intestine, Syngeneic, Open Approach"
182,DRG14903,0DY80Z2,"Transplantation of Small Intestine, Zooplastic, Open Approach"
183,DRG14903,0DYE0Z0,"Transplantation of Large Intestine, Allogeneic, Open Approach"
184,DRG14903,0DYE0Z1,"Transplantation of Large Intestine, Syngeneic, Open Approach"
185,DRG14903,0DYE0Z2,"Transplantation of Large Intestine, Zooplastic, Open Approach"
