DRG,CM-PCS,en
DRG00177,K253,Acute gastric ulcer without hemorrhage or perforation
DRG00177,K257,Chronic gastric ulcer without hemorrhage or perforation
DRG00177,K259,"Gastric ulcer, unspecified as acute or chronic, without hemorrhage or perforation"
DRG00177,K263,Acute duodenal ulcer without hemorrhage or perforation
DRG00177,K267,Chronic duodenal ulcer without hemorrhage or perforation
DRG00177,K269,"Duodenal ulcer, unspecified as acute or chronic, without hemorrhage or perforation"
DRG00177,K273,"Acute peptic ulcer, site unspecified, without hemorrhage or perforation"
DRG00177,K277,"Chronic peptic ulcer, site unspecified, without hemorrhage or perforation"
DRG00177,K279,"Peptic ulcer, site unspecified, unspecified as acute or chronic, without hemorrhage or perforation"
