DRG,CM-PCS,en
DRG13701,A5201,Syphilitic aneurysm of aorta
DRG13701,A5202,Syphilitic aortitis
DRG13701,A5203,Syphilitic endocarditis
DRG13701,B3321,Viral endocarditis
DRG13701,I011,Acute rheumatic endocarditis
DRG13701,I050,Rheumatic mitral stenosis
DRG13701,I051,Rheumatic mitral insufficiency
DRG13701,I052,Rheumatic mitral stenosis with insufficiency
DRG13701,I058,Other rheumatic mitral valve diseases
DRG13701,I059,"Rheumatic mitral valve disease, unspecified"
DRG13701,I060,Rheumatic aortic stenosis
DRG13701,I061,Rheumatic aortic insufficiency
DRG13701,I062,Rheumatic aortic stenosis with insufficiency
DRG13701,I068,Other rheumatic aortic valve diseases
DRG13701,I069,"Rheumatic aortic valve disease, unspecified"
DRG13701,I070,Rheumatic tricuspid stenosis
DRG13701,I071,Rheumatic tricuspid insufficiency
DRG13701,I072,Rheumatic tricuspid stenosis and insufficiency
DRG13701,I078,Other rheumatic tricuspid valve diseases
DRG13701,I079,"Rheumatic tricuspid valve disease, unspecified"
DRG13701,I080,Rheumatic disorders of both mitral and aortic valves
DRG13701,I081,Rheumatic disorders of both mitral and tricuspid valves
DRG13701,I082,Rheumatic disorders of both aortic and tricuspid valves
DRG13701,I083,"Combined rheumatic disorders of mitral, aortic and tricuspid valves"
DRG13701,I088,Other rheumatic multiple valve diseases
DRG13701,I089,"Rheumatic multiple valve disease, unspecified"
DRG13701,I091,"Rheumatic diseases of endocardium, valve unspecified"
DRG13701,I0989,Other specified rheumatic heart diseases
DRG13701,I234,Rupture of chordae tendineae as current complication following acute myocardial infarction
DRG13701,I235,Rupture of papillary muscle as current complication following acute myocardial infarction
DRG13701,I340,Nonrheumatic mitral (valve) insufficiency
DRG13701,I341,Nonrheumatic mitral (valve) prolapse
DRG13701,I342,Nonrheumatic mitral (valve) stenosis
DRG13701,I348,Other nonrheumatic mitral valve disorders
DRG13701,I349,"Nonrheumatic mitral valve disorder, unspecified"
DRG13701,I350,Nonrheumatic aortic (valve) stenosis
DRG13701,I351,Nonrheumatic aortic (valve) insufficiency
DRG13701,I352,Nonrheumatic aortic (valve) stenosis with insufficiency
DRG13701,I358,Other nonrheumatic aortic valve disorders
DRG13701,I359,"Nonrheumatic aortic valve disorder, unspecified"
DRG13701,I360,Nonrheumatic tricuspid (valve) stenosis
DRG13701,I361,Nonrheumatic tricuspid (valve) insufficiency
DRG13701,I362,Nonrheumatic tricuspid (valve) stenosis with insufficiency
DRG13701,I368,Other nonrheumatic tricuspid valve disorders
DRG13701,I369,"Nonrheumatic tricuspid valve disorder, unspecified"
DRG13701,I370,Nonrheumatic pulmonary valve stenosis
DRG13701,I371,Nonrheumatic pulmonary valve insufficiency
DRG13701,I372,Nonrheumatic pulmonary valve stenosis with insufficiency
DRG13701,I378,Other nonrheumatic pulmonary valve disorders
DRG13701,I379,"Nonrheumatic pulmonary valve disorder, unspecified"
DRG13701,I38,"Endocarditis, valve unspecified"
DRG13701,I511,"Rupture of chordae tendineae, not elsewhere classified"
DRG13701,I512,"Rupture of papillary muscle, not elsewhere classified"
DRG13701,I5189,Other ill-defined heart diseases
DRG13701,Q200,Common arterial trunk
DRG13701,Q201,Double outlet right ventricle
DRG13701,Q202,Double outlet left ventricle
DRG13701,Q203,Discordant ventriculoarterial connection
DRG13701,Q204,Double inlet ventricle
DRG13701,Q205,Discordant atrioventricular connection
DRG13701,Q206,Isomerism of atrial appendages
DRG13701,Q208,Other congenital malformations of cardiac chambers and connections
DRG13701,Q209,"Congenital malformation of cardiac chambers and connections, unspecified"
DRG13701,Q210,Ventricular septal defect
DRG13701,Q211,Atrial septal defect
DRG13701,Q212,Atrioventricular septal defect
DRG13701,Q213,Tetralogy of Fallot
DRG13701,Q214,Aortopulmonary septal defect
DRG13701,Q218,Other congenital malformations of cardiac septa
DRG13701,Q219,"Congenital malformation of cardiac septum, unspecified"
DRG13701,Q220,Pulmonary valve atresia
DRG13701,Q221,Congenital pulmonary valve stenosis
DRG13701,Q222,Congenital pulmonary valve insufficiency
DRG13701,Q223,Other congenital malformations of pulmonary valve
DRG13701,Q224,Congenital tricuspid stenosis
DRG13701,Q225,Ebstein's anomaly
DRG13701,Q226,Hypoplastic right heart syndrome
DRG13701,Q228,Other congenital malformations of tricuspid valve
DRG13701,Q229,"Congenital malformation of tricuspid valve, unspecified"
DRG13701,Q230,Congenital stenosis of aortic valve
DRG13701,Q231,Congenital insufficiency of aortic valve
DRG13701,Q232,Congenital mitral stenosis
DRG13701,Q233,Congenital mitral insufficiency
DRG13701,Q234,Hypoplastic left heart syndrome
DRG13701,Q238,Other congenital malformations of aortic and mitral valves
DRG13701,Q239,"Congenital malformation of aortic and mitral valves, unspecified"
DRG13701,Q240,Dextrocardia
DRG13701,Q241,Levocardia
DRG13701,Q242,Cor triatriatum
DRG13701,Q243,Pulmonary infundibular stenosis
DRG13701,Q244,Congenital subaortic stenosis
DRG13701,Q245,Malformation of coronary vessels
DRG13701,Q248,Other specified congenital malformations of heart
DRG13701,Q249,"Congenital malformation of heart, unspecified"
DRG13701,Q250,Patent ductus arteriosus
DRG13701,Q251,Coarctation of aorta
DRG13701,Q252,Atresia of aorta
DRG13701,Q253,Supravalvular aortic stenosis
DRG13701,Q254,Other congenital malformations of aorta
DRG13701,Q255,Atresia of pulmonary artery
DRG13701,Q256,Stenosis of pulmonary artery
DRG13701,Q2571,Coarctation of pulmonary artery
DRG13701,Q2572,Congenital pulmonary arteriovenous malformation
DRG13701,Q2579,Other congenital malformations of pulmonary artery
DRG13701,Q258,Other congenital malformations of other great arteries
DRG13701,Q259,"Congenital malformation of great arteries, unspecified"
DRG13701,Q260,Congenital stenosis of vena cava
DRG13701,Q261,Persistent left superior vena cava
DRG13701,Q262,Total anomalous pulmonary venous connection
DRG13701,Q263,Partial anomalous pulmonary venous connection
DRG13701,Q264,"Anomalous pulmonary venous connection, unspecified"
DRG13701,Q268,Other congenital malformations of great veins
DRG13701,Q269,"Congenital malformation of great vein, unspecified"
DRG13701,Q8740,"Marfan's syndrome, unspecified"
DRG13701,Q87410,Marfan's syndrome with aortic dilation
DRG13701,Q87418,Marfan's syndrome with other cardiovascular manifestations
DRG13701,Q8742,Marfan's syndrome with ocular manifestations
DRG13701,Q8743,Marfan's syndrome with skeletal manifestation
DRG13701,R010,Benign and innocent cardiac murmurs
DRG13701,R011,"Cardiac murmur, unspecified"
DRG13701,T8201XA,"Breakdown (mechanical) of heart valve prosthesis, initial encounter"
DRG13701,T8202XA,"Displacement of heart valve prosthesis, initial encounter"
DRG13701,T8203XA,"Leakage of heart valve prosthesis, initial encounter"
DRG13701,T8209XA,"Other mechanical complication of heart valve prosthesis, initial encounter"
