DRG,CM-PCS,en
DRG18501,A4852,Wound botulism
DRG18501,D100,Benign neoplasm of lip
DRG18501,D101,Benign neoplasm of tongue
DRG18501,D102,Benign neoplasm of floor of mouth
DRG18501,D1030,Benign neoplasm of unspecified part of mouth
DRG18501,D1039,Benign neoplasm of other parts of mouth
DRG18501,D165,Benign neoplasm of lower jaw bone
DRG18501,K000,Anodontia
DRG18501,K001,Supernumerary teeth
DRG18501,K002,Abnormalities of size and form of teeth
DRG18501,K003,Mottled teeth
DRG18501,K004,Disturbances in tooth formation
DRG18501,K005,"Hereditary disturbances in tooth structure, not elsewhere classified"
DRG18501,K006,Disturbances in tooth eruption
DRG18501,K007,Teething syndrome
DRG18501,K008,Other disorders of tooth development
DRG18501,K009,"Disorder of tooth development, unspecified"
DRG18501,K010,Embedded teeth
DRG18501,K011,Impacted teeth
DRG18501,K023,Arrested dental caries
DRG18501,K0251,Dental caries on pit and fissure surface limited to enamel
DRG18501,K0252,Dental caries on pit and fissure surface penetrating into dentin
DRG18501,K0253,Dental caries on pit and fissure surface penetrating into pulp
DRG18501,K0261,Dental caries on smooth surface limited to enamel
DRG18501,K0262,Dental caries on smooth surface penetrating into dentin
DRG18501,K0263,Dental caries on smooth surface penetrating into pulp
DRG18501,K027,Dental root caries
DRG18501,K029,"Dental caries, unspecified"
DRG18501,K030,Excessive attrition of teeth
DRG18501,K031,Abrasion of teeth
DRG18501,K032,Erosion of teeth
DRG18501,K033,Pathological resorption of teeth
DRG18501,K034,Hypercementosis
DRG18501,K035,Ankylosis of teeth
DRG18501,K036,Deposits [accretions] on teeth
DRG18501,K037,Posteruptive color changes of dental hard tissues
DRG18501,K0381,Cracked tooth
DRG18501,K0389,Other specified diseases of hard tissues of teeth
DRG18501,K039,"Disease of hard tissues of teeth, unspecified"
DRG18501,K040,Pulpitis
DRG18501,K041,Necrosis of pulp
DRG18501,K042,Pulp degeneration
DRG18501,K043,Abnormal hard tissue formation in pulp
DRG18501,K044,Acute apical periodontitis of pulpal origin
DRG18501,K045,Chronic apical periodontitis
DRG18501,K046,Periapical abscess with sinus
DRG18501,K047,Periapical abscess without sinus
DRG18501,K048,Radicular cyst
DRG18501,K0490,Unspecified diseases of pulp and periapical tissues
DRG18501,K0499,Other diseases of pulp and periapical tissues
DRG18501,K0500,"Acute gingivitis, plaque induced"
DRG18501,K0501,"Acute gingivitis, non-plaque induced"
DRG18501,K0510,"Chronic gingivitis, plaque induced"
DRG18501,K0511,"Chronic gingivitis, non-plaque induced"
DRG18501,K0520,"Aggressive periodontitis, unspecified"
DRG18501,K0521,"Aggressive periodontitis, localized"
DRG18501,K0522,"Aggressive periodontitis, generalized"
DRG18501,K0530,"Chronic periodontitis, unspecified"
DRG18501,K0531,"Chronic periodontitis, localized"
DRG18501,K0532,"Chronic periodontitis, generalized"
DRG18501,K054,Periodontosis
DRG18501,K055,Other periodontal diseases
DRG18501,K056,"Periodontal disease, unspecified"
DRG18501,K060,Gingival recession
DRG18501,K061,Gingival enlargement
DRG18501,K062,Gingival and edentulous alveolar ridge lesions associated with trauma
DRG18501,K068,Other specified disorders of gingiva and edentulous alveolar ridge
DRG18501,K069,"Disorder of gingiva and edentulous alveolar ridge, unspecified"
DRG18501,K080,Exfoliation of teeth due to systemic causes
DRG18501,K08101,"Complete loss of teeth, unspecified cause, class I"
DRG18501,K08102,"Complete loss of teeth, unspecified cause, class II"
DRG18501,K08103,"Complete loss of teeth, unspecified cause, class III"
DRG18501,K08104,"Complete loss of teeth, unspecified cause, class IV"
DRG18501,K08109,"Complete loss of teeth, unspecified cause, unspecified class"
DRG18501,K08111,"Complete loss of teeth due to trauma, class I"
DRG18501,K08112,"Complete loss of teeth due to trauma, class II"
DRG18501,K08113,"Complete loss of teeth due to trauma, class III"
DRG18501,K08114,"Complete loss of teeth due to trauma, class IV"
DRG18501,K08119,"Complete loss of teeth due to trauma, unspecified class"
DRG18501,K08121,"Complete loss of teeth due to periodontal diseases, class I"
DRG18501,K08122,"Complete loss of teeth due to periodontal diseases, class II"
DRG18501,K08123,"Complete loss of teeth due to periodontal diseases, class III"
DRG18501,K08124,"Complete loss of teeth due to periodontal diseases, class IV"
DRG18501,K08129,"Complete loss of teeth due to periodontal diseases, unspecified class"
DRG18501,K08131,"Complete loss of teeth due to caries, class I"
DRG18501,K08132,"Complete loss of teeth due to caries, class II"
DRG18501,K08133,"Complete loss of teeth due to caries, class III"
DRG18501,K08134,"Complete loss of teeth due to caries, class IV"
DRG18501,K08139,"Complete loss of teeth due to caries, unspecified class"
DRG18501,K08191,"Complete loss of teeth due to other specified cause, class I"
DRG18501,K08192,"Complete loss of teeth due to other specified cause, class II"
DRG18501,K08193,"Complete loss of teeth due to other specified cause, class III"
DRG18501,K08194,"Complete loss of teeth due to other specified cause, class IV"
DRG18501,K08199,"Complete loss of teeth due to other specified cause, unspecified class"
DRG18501,K0820,Unspecified atrophy of edentulous alveolar ridge
DRG18501,K0821,Minimal atrophy of the mandible
DRG18501,K0822,Moderate atrophy of the mandible
DRG18501,K0823,Severe atrophy of the mandible
DRG18501,K0824,Minimal atrophy of maxilla
DRG18501,K0825,Moderate atrophy of the maxilla
DRG18501,K0826,Severe atrophy of the maxilla
DRG18501,K083,Retained dental root
DRG18501,K08401,"Partial loss of teeth, unspecified cause, class I"
DRG18501,K08402,"Partial loss of teeth, unspecified cause, class II"
DRG18501,K08403,"Partial loss of teeth, unspecified cause, class III"
DRG18501,K08404,"Partial loss of teeth, unspecified cause, class IV"
DRG18501,K08409,"Partial loss of teeth, unspecified cause, unspecified class"
DRG18501,K08411,"Partial loss of teeth due to trauma, class I"
DRG18501,K08412,"Partial loss of teeth due to trauma, class II"
DRG18501,K08413,"Partial loss of teeth due to trauma, class III"
DRG18501,K08414,"Partial loss of teeth due to trauma, class IV"
DRG18501,K08419,"Partial loss of teeth due to trauma, unspecified class"
DRG18501,K08421,"Partial loss of teeth due to periodontal diseases, class I"
DRG18501,K08422,"Partial loss of teeth due to periodontal diseases, class II"
DRG18501,K08423,"Partial loss of teeth due to periodontal diseases, class III"
DRG18501,K08424,"Partial loss of teeth due to periodontal diseases, class IV"
DRG18501,K08429,"Partial loss of teeth due to periodontal diseases, unspecified class"
DRG18501,K08431,"Partial loss of teeth due to caries, class I"
DRG18501,K08432,"Partial loss of teeth due to caries, class II"
DRG18501,K08433,"Partial loss of teeth due to caries, class III"
DRG18501,K08434,"Partial loss of teeth due to caries, class IV"
DRG18501,K08439,"Partial loss of teeth due to caries, unspecified class"
DRG18501,K08491,"Partial loss of teeth due to other specified cause, class I"
DRG18501,K08492,"Partial loss of teeth due to other specified cause, class II"
DRG18501,K08493,"Partial loss of teeth due to other specified cause, class III"
DRG18501,K08494,"Partial loss of teeth due to other specified cause, class IV"
DRG18501,K08499,"Partial loss of teeth due to other specified cause, unspecified class"
DRG18501,K0850,"Unsatisfactory restoration of tooth, unspecified"
DRG18501,K0851,Open restoration margins of tooth
DRG18501,K0852,Unrepairable overhanging of dental restorative materials
DRG18501,K08530,Fractured dental restorative material without loss of material
DRG18501,K08531,Fractured dental restorative material with loss of material
DRG18501,K08539,"Fractured dental restorative material, unspecified"
DRG18501,K0854,Contour of existing restoration of tooth biologically incompatible with oral health
DRG18501,K0855,Allergy to existing dental restorative material
DRG18501,K0856,Poor aesthetic of existing restoration of tooth
DRG18501,K0859,Other unsatisfactory restoration of tooth
DRG18501,K088,Other specified disorders of teeth and supporting structures
DRG18501,K089,"Disorder of teeth and supporting structures, unspecified"
DRG18501,K090,Developmental odontogenic cysts
DRG18501,K091,Developmental (nonodontogenic) cysts of oral region
DRG18501,K098,"Other cysts of oral region, not elsewhere classified"
DRG18501,K099,"Cyst of oral region, unspecified"
DRG18501,K120,Recurrent oral aphthae
DRG18501,K121,Other forms of stomatitis
DRG18501,K122,Cellulitis and abscess of mouth
DRG18501,K1230,"Oral mucositis (ulcerative), unspecified"
DRG18501,K1231,Oral mucositis (ulcerative) due to antineoplastic therapy
DRG18501,K1232,Oral mucositis (ulcerative) due to other drugs
DRG18501,K1233,Oral mucositis (ulcerative) due to radiation
DRG18501,K1239,Other oral mucositis (ulcerative)
DRG18501,K130,Diseases of lips
DRG18501,K131,Cheek and lip biting
DRG18501,K1321,"Leukoplakia of oral mucosa, including tongue"
DRG18501,K1322,Minimal keratinized residual ridge mucosa
DRG18501,K1323,Excessive keratinized residual ridge mucosa
DRG18501,K1324,Leukokeratosis nicotina palati
DRG18501,K1329,"Other disturbances of oral epithelium, including tongue"
DRG18501,K133,Hairy leukoplakia
DRG18501,K134,Granuloma and granuloma-like lesions of oral mucosa
DRG18501,K135,Oral submucous fibrosis
DRG18501,K136,Irritative hyperplasia of oral mucosa
DRG18501,K1370,Unspecified lesions of oral mucosa
DRG18501,K1379,Other lesions of oral mucosa
DRG18501,K140,Glossitis
DRG18501,K141,Geographic tongue
DRG18501,K142,Median rhomboid glossitis
DRG18501,K143,Hypertrophy of tongue papillae
DRG18501,K144,Atrophy of tongue papillae
DRG18501,K145,Plicated tongue
DRG18501,K146,Glossodynia
DRG18501,K148,Other diseases of tongue
DRG18501,K149,"Disease of tongue, unspecified"
DRG18501,M2600,Unspecified anomaly of jaw size
DRG18501,M2601,Maxillary hyperplasia
DRG18501,M2602,Maxillary hypoplasia
DRG18501,M2603,Mandibular hyperplasia
DRG18501,M2604,Mandibular hypoplasia
DRG18501,M2605,Macrogenia
DRG18501,M2606,Microgenia
DRG18501,M2607,Excessive tuberosity of jaw
DRG18501,M2609,Other specified anomalies of jaw size
DRG18501,M2610,Unspecified anomaly of jaw-cranial base relationship
DRG18501,M2611,Maxillary asymmetry
DRG18501,M2612,Other jaw asymmetry
DRG18501,M2619,Other specified anomalies of jaw-cranial base relationship
DRG18501,M2620,Unspecified anomaly of dental arch relationship
DRG18501,M26211,"Malocclusion, Angle's class I"
DRG18501,M26212,"Malocclusion, Angle's class II"
DRG18501,M26213,"Malocclusion, Angle's class III"
DRG18501,M26219,"Malocclusion, Angle's class, unspecified"
DRG18501,M26220,Open anterior occlusal relationship
DRG18501,M26221,Open posterior occlusal relationship
DRG18501,M2623,Excessive horizontal overlap
DRG18501,M2624,Reverse articulation
DRG18501,M2625,Anomalies of interarch distance
DRG18501,M2629,Other anomalies of dental arch relationship
DRG18501,M2630,Unspecified anomaly of tooth position of fully erupted tooth or teeth
DRG18501,M2631,Crowding of fully erupted teeth
DRG18501,M2632,Excessive spacing of fully erupted teeth
DRG18501,M2633,Horizontal displacement of fully erupted tooth or teeth
DRG18501,M2634,Vertical displacement of fully erupted tooth or teeth
DRG18501,M2635,Rotation of fully erupted tooth or teeth
DRG18501,M2636,Insufficient interocclusal distance of fully erupted teeth (ridge)
DRG18501,M2637,Excessive interocclusal distance of fully erupted teeth
DRG18501,M2639,Other anomalies of tooth position of fully erupted tooth or teeth
DRG18501,M264,"Malocclusion, unspecified"
DRG18501,M2650,"Dentofacial functional abnormalities, unspecified"
DRG18501,M2651,Abnormal jaw closure
DRG18501,M2652,Limited mandibular range of motion
DRG18501,M2653,Deviation in opening and closing of the mandible
DRG18501,M2654,Insufficient anterior guidance
DRG18501,M2655,Centric occlusion maximum intercuspation discrepancy
DRG18501,M2656,Non-working side interference
DRG18501,M2657,Lack of posterior occlusal support
DRG18501,M2659,Other dentofacial functional abnormalities
DRG18501,M2660,"Temporomandibular joint disorder, unspecified"
DRG18501,M2661,Adhesions and ankylosis of temporomandibular joint
DRG18501,M2662,Arthralgia of temporomandibular joint
DRG18501,M2663,Articular disc disorder of temporomandibular joint
DRG18501,M2669,Other specified disorders of temporomandibular joint
DRG18501,M2670,Unspecified alveolar anomaly
DRG18501,M2671,Alveolar maxillary hyperplasia
DRG18501,M2672,Alveolar mandibular hyperplasia
DRG18501,M2673,Alveolar maxillary hypoplasia
DRG18501,M2674,Alveolar mandibular hypoplasia
DRG18501,M2679,Other specified alveolar anomalies
DRG18501,M2681,Anterior soft tissue impingement
DRG18501,M2682,Posterior soft tissue impingement
DRG18501,M2689,Other dentofacial anomalies
DRG18501,M269,"Dentofacial anomaly, unspecified"
DRG18501,M270,Developmental disorders of jaws
DRG18501,M271,"Giant cell granuloma, central"
DRG18501,M272,Inflammatory conditions of jaws
DRG18501,M273,Alveolitis of jaws
DRG18501,M2740,Unspecified cyst of jaw
DRG18501,M2749,Other cysts of jaw
DRG18501,M2751,Perforation of root canal space due to endodontic treatment
DRG18501,M2752,Endodontic overfill
DRG18501,M2753,Endodontic underfill
DRG18501,M2759,Other periradicular pathology associated with previous endodontic treatment
DRG18501,M2761,Osseointegration failure of dental implant
DRG18501,M2762,Post-osseointegration biological failure of dental implant
DRG18501,M2763,Post-osseointegration mechanical failure of dental implant
DRG18501,M2769,Other endosseous dental implant failure
DRG18501,M278,Other specified diseases of jaws
DRG18501,M279,"Disease of jaws, unspecified"
DRG18501,Q184,Macrostomia
DRG18501,Q185,Microstomia
DRG18501,Q186,Macrocheilia
DRG18501,Q187,Microcheilia
DRG18501,Q351,Cleft hard palate
DRG18501,Q353,Cleft soft palate
DRG18501,Q355,Cleft hard palate with cleft soft palate
DRG18501,Q357,Cleft uvula
DRG18501,Q359,"Cleft palate, unspecified"
DRG18501,Q360,"Cleft lip, bilateral"
DRG18501,Q361,"Cleft lip, median"
DRG18501,Q369,"Cleft lip, unilateral"
DRG18501,Q370,Cleft hard palate with bilateral cleft lip
DRG18501,Q371,Cleft hard palate with unilateral cleft lip
DRG18501,Q372,Cleft soft palate with bilateral cleft lip
DRG18501,Q373,Cleft soft palate with unilateral cleft lip
DRG18501,Q374,Cleft hard and soft palate with bilateral cleft lip
DRG18501,Q375,Cleft hard and soft palate with unilateral cleft lip
DRG18501,Q378,Unspecified cleft palate with bilateral cleft lip
DRG18501,Q379,Unspecified cleft palate with unilateral cleft lip
DRG18501,Q380,"Congenital malformations of lips, not elsewhere classified"
DRG18501,Q381,Ankyloglossia
DRG18501,Q382,Macroglossia
DRG18501,Q383,Other congenital malformations of tongue
DRG18501,Q386,Other congenital malformations of mouth
DRG18501,R6884,Jaw pain
DRG18501,S01501A,"Unspecified open wound of lip, initial encounter"
DRG18501,S01502A,"Unspecified open wound of oral cavity, initial encounter"
DRG18501,S01511A,"Laceration without foreign body of lip, initial encounter"
DRG18501,S01512A,"Laceration without foreign body of oral cavity, initial encounter"
DRG18501,S01521A,"Laceration with foreign body of lip, initial encounter"
DRG18501,S01522A,"Laceration with foreign body of oral cavity, initial encounter"
DRG18501,S01531A,"Puncture wound without foreign body of lip, initial encounter"
DRG18501,S01532A,"Puncture wound without foreign body of oral cavity, initial encounter"
DRG18501,S01541A,"Puncture wound with foreign body of lip, initial encounter"
DRG18501,S01542A,"Puncture wound with foreign body of oral cavity, initial encounter"
DRG18501,S01551A,"Open bite of lip, initial encounter"
DRG18501,S01552A,"Open bite of oral cavity, initial encounter"
DRG18501,S02400A,"Malar fracture unspecified, initial encounter for closed fracture"
DRG18501,S02400B,"Malar fracture unspecified, initial encounter for open fracture"
DRG18501,S02401A,"Maxillary fracture, unspecified, initial encounter for closed fracture"
DRG18501,S02401B,"Maxillary fracture, unspecified, initial encounter for open fracture"
DRG18501,S02402A,"Zygomatic fracture, unspecified, initial encounter for closed fracture"
DRG18501,S02402B,"Zygomatic fracture, unspecified, initial encounter for open fracture"
DRG18501,S02411A,"LeFort I fracture, initial encounter for closed fracture"
DRG18501,S02411B,"LeFort I fracture, initial encounter for open fracture"
DRG18501,S02412A,"LeFort II fracture, initial encounter for closed fracture"
DRG18501,S02412B,"LeFort II fracture, initial encounter for open fracture"
DRG18501,S02413A,"LeFort III fracture, initial encounter for closed fracture"
DRG18501,S02413B,"LeFort III fracture, initial encounter for open fracture"
DRG18501,S025XXA,"Fracture of tooth (traumatic), initial encounter for closed fracture"
DRG18501,S025XXB,"Fracture of tooth (traumatic), initial encounter for open fracture"
DRG18501,S02600A,"Fracture of unspecified part of body of mandible, initial encounter for closed fracture"
DRG18501,S02600B,"Fracture of unspecified part of body of mandible, initial encounter for open fracture"
DRG18501,S02609A,"Fracture of mandible, unspecified, initial encounter for closed fracture"
DRG18501,S02609B,"Fracture of mandible, unspecified, initial encounter for open fracture"
DRG18501,S0261XA,"Fracture of condylar process of mandible, initial encounter for closed fracture"
DRG18501,S0261XB,"Fracture of condylar process of mandible, initial encounter for open fracture"
DRG18501,S0262XA,"Fracture of subcondylar process of mandible, initial encounter for closed fracture"
DRG18501,S0262XB,"Fracture of subcondylar process of mandible, initial encounter for open fracture"
DRG18501,S0263XA,"Fracture of coronoid process of mandible, initial encounter for closed fracture"
DRG18501,S0263XB,"Fracture of coronoid process of mandible, initial encounter for open fracture"
DRG18501,S0264XA,"Fracture of ramus of mandible, initial encounter for closed fracture"
DRG18501,S0264XB,"Fracture of ramus of mandible, initial encounter for open fracture"
DRG18501,S0265XA,"Fracture of angle of mandible, initial encounter for closed fracture"
DRG18501,S0265XB,"Fracture of angle of mandible, initial encounter for open fracture"
DRG18501,S0266XA,"Fracture of symphysis of mandible, initial encounter for closed fracture"
DRG18501,S0266XB,"Fracture of symphysis of mandible, initial encounter for open fracture"
DRG18501,S0267XA,"Fracture of alveolus of mandible, initial encounter for closed fracture"
DRG18501,S0267XB,"Fracture of alveolus of mandible, initial encounter for open fracture"
DRG18501,S0269XA,"Fracture of mandible of other specified site, initial encounter for closed fracture"
DRG18501,S0269XB,"Fracture of mandible of other specified site, initial encounter for open fracture"
DRG18501,S030XXA,"Dislocation of jaw, initial encounter"
DRG18501,S032XXA,"Dislocation of tooth, initial encounter"
DRG18501,S034XXA,"Sprain of jaw, initial encounter"
DRG18501,T180XXA,"Foreign body in mouth, initial encounter"
