DRG,CM-PCS,en
DRG48202,A155,"Tuberculosis of larynx, trachea and bronchus"
DRG48202,A360,Pharyngeal diphtheria
DRG48202,A361,Nasopharyngeal diphtheria
DRG48202,A362,Laryngeal diphtheria
DRG48202,A3689,Other diphtheritic complications
DRG48202,A4852,Wound botulism
DRG48202,A545,Gonococcal pharyngitis
DRG48202,A564,Chlamydial infection of pharynx
DRG48202,A665,Gangosa
DRG48202,A690,Necrotizing ulcerative stomatitis
DRG48202,A691,Other Vincent's infections
DRG48202,B002,Herpesviral gingivostomatitis and pharyngotonsillitis
DRG48202,B085,Enteroviral vesicular pharyngitis
DRG48202,B370,Candidal stomatitis
DRG48202,B3783,Candidal cheilitis
DRG48202,D0000,"Carcinoma in situ of oral cavity, unspecified site"
DRG48202,D0001,Carcinoma in situ of labial mucosa and vermilion border
DRG48202,D0002,Carcinoma in situ of buccal mucosa
DRG48202,D0003,Carcinoma in situ of gingiva and edentulous alveolar ridge
DRG48202,D0004,Carcinoma in situ of soft palate
DRG48202,D0005,Carcinoma in situ of hard palate
DRG48202,D0006,Carcinoma in situ of floor of mouth
DRG48202,D0007,Carcinoma in situ of tongue
DRG48202,D0008,Carcinoma in situ of pharynx
DRG48202,D020,Carcinoma in situ of larynx
DRG48202,D100,Benign neoplasm of lip
DRG48202,D101,Benign neoplasm of tongue
DRG48202,D102,Benign neoplasm of floor of mouth
DRG48202,D1030,Benign neoplasm of unspecified part of mouth
DRG48202,D1039,Benign neoplasm of other parts of mouth
DRG48202,D104,Benign neoplasm of tonsil
DRG48202,D105,Benign neoplasm of other parts of oropharynx
DRG48202,D106,Benign neoplasm of nasopharynx
DRG48202,D107,Benign neoplasm of hypopharynx
DRG48202,D109,"Benign neoplasm of pharynx, unspecified"
DRG48202,D110,Benign neoplasm of parotid gland
DRG48202,D117,Benign neoplasm of other major salivary glands
DRG48202,D119,"Benign neoplasm of major salivary gland, unspecified"
DRG48202,D140,"Benign neoplasm of middle ear, nasal cavity and accessory sinuses"
DRG48202,D141,Benign neoplasm of larynx
DRG48202,D164,Benign neoplasm of bones of skull and face
DRG48202,D165,Benign neoplasm of lower jaw bone
DRG48202,D1800,Hemangioma unspecified site
DRG48202,D1801,Hemangioma of skin and subcutaneous tissue
DRG48202,D1809,Hemangioma of other sites
DRG48202,D34,Benign neoplasm of thyroid gland
DRG48202,E034,Atrophy of thyroid (acquired)
DRG48202,E041,Nontoxic single thyroid nodule
DRG48202,E0500,Thyrotoxicosis with diffuse goiter without thyrotoxic crisis or storm
DRG48202,E0501,Thyrotoxicosis with diffuse goiter with thyrotoxic crisis or storm
DRG48202,E0510,Thyrotoxicosis with toxic single thyroid nodule without thyrotoxic crisis or storm
DRG48202,E0511,Thyrotoxicosis with toxic single thyroid nodule with thyrotoxic crisis or storm
DRG48202,E0520,Thyrotoxicosis with toxic multinodular goiter without thyrotoxic crisis or storm
DRG48202,E0521,Thyrotoxicosis with toxic multinodular goiter with thyrotoxic crisis or storm
DRG48202,E0530,Thyrotoxicosis from ectopic thyroid tissue without thyrotoxic crisis or storm
DRG48202,E0531,Thyrotoxicosis from ectopic thyroid tissue with thyrotoxic crisis or storm
DRG48202,E0540,Thyrotoxicosis factitia without thyrotoxic crisis or storm
DRG48202,E0541,Thyrotoxicosis factitia with thyrotoxic crisis or storm
DRG48202,E0580,Other thyrotoxicosis without thyrotoxic crisis or storm
DRG48202,E0581,Other thyrotoxicosis with thyrotoxic crisis or storm
DRG48202,E0590,"Thyrotoxicosis, unspecified without thyrotoxic crisis or storm"
DRG48202,E0591,"Thyrotoxicosis, unspecified with thyrotoxic crisis or storm"
DRG48202,E060,Acute thyroiditis
DRG48202,E061,Subacute thyroiditis
DRG48202,E062,Chronic thyroiditis with transient thyrotoxicosis
DRG48202,E063,Autoimmune thyroiditis
DRG48202,E064,Drug-induced thyroiditis
DRG48202,E065,Other chronic thyroiditis
DRG48202,E069,"Thyroiditis, unspecified"
DRG48202,E0789,Other specified disorders of thyroid
DRG48202,E079,"Disorder of thyroid, unspecified"
DRG48202,J00,Acute nasopharyngitis [common cold]
DRG48202,J020,Streptococcal pharyngitis
DRG48202,J028,Acute pharyngitis due to other specified organisms
DRG48202,J029,"Acute pharyngitis, unspecified"
DRG48202,J0300,"Acute streptococcal tonsillitis, unspecified"
DRG48202,J0301,Acute recurrent streptococcal tonsillitis
DRG48202,J0380,Acute tonsillitis due to other specified organisms
DRG48202,J0381,Acute recurrent tonsillitis due to other specified organisms
DRG48202,J0390,"Acute tonsillitis, unspecified"
DRG48202,J0391,"Acute recurrent tonsillitis, unspecified"
DRG48202,J040,Acute laryngitis
DRG48202,J042,Acute laryngotracheitis
DRG48202,J0430,"Supraglottitis, unspecified, without obstruction"
DRG48202,J0431,"Supraglottitis, unspecified, with obstruction"
DRG48202,J050,Acute obstructive laryngitis [croup]
DRG48202,J0510,Acute epiglottitis without obstruction
DRG48202,J0511,Acute epiglottitis with obstruction
DRG48202,J060,Acute laryngopharyngitis
DRG48202,J069,"Acute upper respiratory infection, unspecified"
DRG48202,J311,Chronic nasopharyngitis
DRG48202,J312,Chronic pharyngitis
DRG48202,J342,Deviated nasal septum
DRG48202,J3501,Chronic tonsillitis
DRG48202,J3502,Chronic adenoiditis
DRG48202,J3503,Chronic tonsillitis and adenoiditis
DRG48202,J351,Hypertrophy of tonsils
DRG48202,J352,Hypertrophy of adenoids
DRG48202,J353,Hypertrophy of tonsils with hypertrophy of adenoids
DRG48202,J358,Other chronic diseases of tonsils and adenoids
DRG48202,J359,"Chronic disease of tonsils and adenoids, unspecified"
DRG48202,J36,Peritonsillar abscess
DRG48202,J370,Chronic laryngitis
DRG48202,J371,Chronic laryngotracheitis
DRG48202,J3800,"Paralysis of vocal cords and larynx, unspecified"
DRG48202,J3801,"Paralysis of vocal cords and larynx, unilateral"
DRG48202,J3802,"Paralysis of vocal cords and larynx, bilateral"
DRG48202,J381,Polyp of vocal cord and larynx
DRG48202,J382,Nodules of vocal cords
DRG48202,J383,Other diseases of vocal cords
DRG48202,J384,Edema of larynx
DRG48202,J385,Laryngeal spasm
DRG48202,J386,Stenosis of larynx
DRG48202,J387,Other diseases of larynx
DRG48202,J390,Retropharyngeal and parapharyngeal abscess
DRG48202,J391,Other abscess of pharynx
DRG48202,J392,Other diseases of pharynx
DRG48202,J393,"Upper respiratory tract hypersensitivity reaction, site unspecified"
DRG48202,J398,Other specified diseases of upper respiratory tract
DRG48202,J399,"Disease of upper respiratory tract, unspecified"
DRG48202,J45990,Exercise induced bronchospasm
DRG48202,J9500,Unspecified tracheostomy complication
DRG48202,J9501,Hemorrhage from tracheostomy stoma
DRG48202,J9502,Infection of tracheostomy stoma
DRG48202,J9503,Malfunction of tracheostomy stoma
DRG48202,J9504,Tracheo-esophageal fistula following tracheostomy
DRG48202,J9509,Other tracheostomy complication
DRG48202,J9801,Acute bronchospasm
DRG48202,J9809,"Other diseases of bronchus, not elsewhere classified"
DRG48202,K000,Anodontia
DRG48202,K001,Supernumerary teeth
DRG48202,K002,Abnormalities of size and form of teeth
DRG48202,K003,Mottled teeth
DRG48202,K004,Disturbances in tooth formation
DRG48202,K005,"Hereditary disturbances in tooth structure, not elsewhere classified"
DRG48202,K006,Disturbances in tooth eruption
DRG48202,K007,Teething syndrome
DRG48202,K008,Other disorders of tooth development
DRG48202,K009,"Disorder of tooth development, unspecified"
DRG48202,K010,Embedded teeth
DRG48202,K011,Impacted teeth
DRG48202,K023,Arrested dental caries
DRG48202,K0251,Dental caries on pit and fissure surface limited to enamel
DRG48202,K0252,Dental caries on pit and fissure surface penetrating into dentin
DRG48202,K0253,Dental caries on pit and fissure surface penetrating into pulp
DRG48202,K0261,Dental caries on smooth surface limited to enamel
DRG48202,K0262,Dental caries on smooth surface penetrating into dentin
DRG48202,K0263,Dental caries on smooth surface penetrating into pulp
DRG48202,K027,Dental root caries
DRG48202,K029,"Dental caries, unspecified"
DRG48202,K030,Excessive attrition of teeth
DRG48202,K031,Abrasion of teeth
DRG48202,K032,Erosion of teeth
DRG48202,K033,Pathological resorption of teeth
DRG48202,K034,Hypercementosis
DRG48202,K035,Ankylosis of teeth
DRG48202,K036,Deposits [accretions] on teeth
DRG48202,K037,Posteruptive color changes of dental hard tissues
DRG48202,K0389,Other specified diseases of hard tissues of teeth
DRG48202,K039,"Disease of hard tissues of teeth, unspecified"
DRG48202,K040,Pulpitis
DRG48202,K041,Necrosis of pulp
DRG48202,K042,Pulp degeneration
DRG48202,K043,Abnormal hard tissue formation in pulp
DRG48202,K044,Acute apical periodontitis of pulpal origin
DRG48202,K045,Chronic apical periodontitis
DRG48202,K046,Periapical abscess with sinus
DRG48202,K047,Periapical abscess without sinus
DRG48202,K048,Radicular cyst
DRG48202,K0490,Unspecified diseases of pulp and periapical tissues
DRG48202,K0499,Other diseases of pulp and periapical tissues
DRG48202,K0500,"Acute gingivitis, plaque induced"
DRG48202,K0501,"Acute gingivitis, non-plaque induced"
DRG48202,K0510,"Chronic gingivitis, plaque induced"
DRG48202,K0511,"Chronic gingivitis, non-plaque induced"
DRG48202,K0520,"Aggressive periodontitis, unspecified"
DRG48202,K0521,"Aggressive periodontitis, localized"
DRG48202,K0522,"Aggressive periodontitis, generalized"
DRG48202,K0530,"Chronic periodontitis, unspecified"
DRG48202,K0531,"Chronic periodontitis, localized"
DRG48202,K0532,"Chronic periodontitis, generalized"
DRG48202,K054,Periodontosis
DRG48202,K055,Other periodontal diseases
DRG48202,K056,"Periodontal disease, unspecified"
DRG48202,K060,Gingival recession
DRG48202,K061,Gingival enlargement
DRG48202,K062,Gingival and edentulous alveolar ridge lesions associated with trauma
DRG48202,K068,Other specified disorders of gingiva and edentulous alveolar ridge
DRG48202,K069,"Disorder of gingiva and edentulous alveolar ridge, unspecified"
DRG48202,K080,Exfoliation of teeth due to systemic causes
DRG48202,K08101,"Complete loss of teeth, unspecified cause, class I"
DRG48202,K08102,"Complete loss of teeth, unspecified cause, class II"
DRG48202,K08103,"Complete loss of teeth, unspecified cause, class III"
DRG48202,K08104,"Complete loss of teeth, unspecified cause, class IV"
DRG48202,K08109,"Complete loss of teeth, unspecified cause, unspecified class"
DRG48202,K08111,"Complete loss of teeth due to trauma, class I"
DRG48202,K08112,"Complete loss of teeth due to trauma, class II"
DRG48202,K08113,"Complete loss of teeth due to trauma, class III"
DRG48202,K08114,"Complete loss of teeth due to trauma, class IV"
DRG48202,K08119,"Complete loss of teeth due to trauma, unspecified class"
DRG48202,K08121,"Complete loss of teeth due to periodontal diseases, class I"
DRG48202,K08122,"Complete loss of teeth due to periodontal diseases, class II"
DRG48202,K08123,"Complete loss of teeth due to periodontal diseases, class III"
DRG48202,K08124,"Complete loss of teeth due to periodontal diseases, class IV"
DRG48202,K08129,"Complete loss of teeth due to periodontal diseases, unspecified class"
DRG48202,K08131,"Complete loss of teeth due to caries, class I"
DRG48202,K08132,"Complete loss of teeth due to caries, class II"
DRG48202,K08133,"Complete loss of teeth due to caries, class III"
DRG48202,K08134,"Complete loss of teeth due to caries, class IV"
DRG48202,K08139,"Complete loss of teeth due to caries, unspecified class"
DRG48202,K08191,"Complete loss of teeth due to other specified cause, class I"
DRG48202,K08192,"Complete loss of teeth due to other specified cause, class II"
DRG48202,K08193,"Complete loss of teeth due to other specified cause, class III"
DRG48202,K08194,"Complete loss of teeth due to other specified cause, class IV"
DRG48202,K08199,"Complete loss of teeth due to other specified cause, unspecified class"
DRG48202,K0820,Unspecified atrophy of edentulous alveolar ridge
DRG48202,K0821,Minimal atrophy of the mandible
DRG48202,K0822,Moderate atrophy of the mandible
DRG48202,K0823,Severe atrophy of the mandible
DRG48202,K0824,Minimal atrophy of maxilla
DRG48202,K0825,Moderate atrophy of the maxilla
DRG48202,K0826,Severe atrophy of the maxilla
DRG48202,K083,Retained dental root
DRG48202,K08401,"Partial loss of teeth, unspecified cause, class I"
DRG48202,K08402,"Partial loss of teeth, unspecified cause, class II"
DRG48202,K08403,"Partial loss of teeth, unspecified cause, class III"
DRG48202,K08404,"Partial loss of teeth, unspecified cause, class IV"
DRG48202,K08409,"Partial loss of teeth, unspecified cause, unspecified class"
DRG48202,K08411,"Partial loss of teeth due to trauma, class I"
DRG48202,K08412,"Partial loss of teeth due to trauma, class II"
DRG48202,K08413,"Partial loss of teeth due to trauma, class III"
DRG48202,K08414,"Partial loss of teeth due to trauma, class IV"
DRG48202,K08419,"Partial loss of teeth due to trauma, unspecified class"
DRG48202,K08421,"Partial loss of teeth due to periodontal diseases, class I"
DRG48202,K08422,"Partial loss of teeth due to periodontal diseases, class II"
DRG48202,K08423,"Partial loss of teeth due to periodontal diseases, class III"
DRG48202,K08424,"Partial loss of teeth due to periodontal diseases, class IV"
DRG48202,K08429,"Partial loss of teeth due to periodontal diseases, unspecified class"
DRG48202,K08431,"Partial loss of teeth due to caries, class I"
DRG48202,K08432,"Partial loss of teeth due to caries, class II"
DRG48202,K08433,"Partial loss of teeth due to caries, class III"
DRG48202,K08434,"Partial loss of teeth due to caries, class IV"
DRG48202,K08439,"Partial loss of teeth due to caries, unspecified class"
DRG48202,K08491,"Partial loss of teeth due to other specified cause, class I"
DRG48202,K08492,"Partial loss of teeth due to other specified cause, class II"
DRG48202,K08493,"Partial loss of teeth due to other specified cause, class III"
DRG48202,K08494,"Partial loss of teeth due to other specified cause, class IV"
DRG48202,K08499,"Partial loss of teeth due to other specified cause, unspecified class"
DRG48202,K0850,"Unsatisfactory restoration of tooth, unspecified"
DRG48202,K0851,Open restoration margins of tooth
DRG48202,K0852,Unrepairable overhanging of dental restorative materials
DRG48202,K08530,Fractured dental restorative material without loss of material
DRG48202,K08531,Fractured dental restorative material with loss of material
DRG48202,K08539,"Fractured dental restorative material, unspecified"
DRG48202,K0854,Contour of existing restoration of tooth biologically incompatible with oral health
DRG48202,K0855,Allergy to existing dental restorative material
DRG48202,K0856,Poor aesthetic of existing restoration of tooth
DRG48202,K0859,Other unsatisfactory restoration of tooth
DRG48202,K088,Other specified disorders of teeth and supporting structures
DRG48202,K089,"Disorder of teeth and supporting structures, unspecified"
DRG48202,K090,Developmental odontogenic cysts
DRG48202,K091,Developmental (nonodontogenic) cysts of oral region
DRG48202,K098,"Other cysts of oral region, not elsewhere classified"
DRG48202,K099,"Cyst of oral region, unspecified"
DRG48202,K110,Atrophy of salivary gland
DRG48202,K111,Hypertrophy of salivary gland
DRG48202,K1120,"Sialoadenitis, unspecified"
DRG48202,K1121,Acute sialoadenitis
DRG48202,K1122,Acute recurrent sialoadenitis
DRG48202,K1123,Chronic sialoadenitis
DRG48202,K113,Abscess of salivary gland
DRG48202,K114,Fistula of salivary gland
DRG48202,K115,Sialolithiasis
DRG48202,K116,Mucocele of salivary gland
DRG48202,K117,Disturbances of salivary secretion
DRG48202,K118,Other diseases of salivary glands
DRG48202,K119,"Disease of salivary gland, unspecified"
DRG48202,K120,Recurrent oral aphthae
DRG48202,K121,Other forms of stomatitis
DRG48202,K122,Cellulitis and abscess of mouth
DRG48202,K1230,"Oral mucositis (ulcerative), unspecified"
DRG48202,K1231,Oral mucositis (ulcerative) due to antineoplastic therapy
DRG48202,K1232,Oral mucositis (ulcerative) due to other drugs
DRG48202,K1233,Oral mucositis (ulcerative) due to radiation
DRG48202,K1239,Other oral mucositis (ulcerative)
DRG48202,K130,Diseases of lips
DRG48202,K131,Cheek and lip biting
DRG48202,K1321,"Leukoplakia of oral mucosa, including tongue"
DRG48202,K1322,Minimal keratinized residual ridge mucosa
DRG48202,K1323,Excessive keratinized residual ridge mucosa
DRG48202,K1324,Leukokeratosis nicotina palati
DRG48202,K1329,"Other disturbances of oral epithelium, including tongue"
DRG48202,K133,Hairy leukoplakia
DRG48202,K134,Granuloma and granuloma-like lesions of oral mucosa
DRG48202,K135,Oral submucous fibrosis
DRG48202,K136,Irritative hyperplasia of oral mucosa
DRG48202,K1370,Unspecified lesions of oral mucosa
DRG48202,K1379,Other lesions of oral mucosa
DRG48202,K140,Glossitis
DRG48202,K141,Geographic tongue
DRG48202,K142,Median rhomboid glossitis
DRG48202,K143,Hypertrophy of tongue papillae
DRG48202,K144,Atrophy of tongue papillae
DRG48202,K145,Plicated tongue
DRG48202,K146,Glossodynia
DRG48202,K148,Other diseases of tongue
DRG48202,K149,"Disease of tongue, unspecified"
DRG48202,L0201,Cutaneous abscess of face
DRG48202,L0211,Cutaneous abscess of neck
DRG48202,L03211,Cellulitis of face
DRG48202,L03212,Acute lymphangitis of face
DRG48202,L03221,Cellulitis of neck
DRG48202,L03222,Acute lymphangitis of neck
DRG48202,M2600,Unspecified anomaly of jaw size
DRG48202,M2601,Maxillary hyperplasia
DRG48202,M2602,Maxillary hypoplasia
DRG48202,M2603,Mandibular hyperplasia
DRG48202,M2604,Mandibular hypoplasia
DRG48202,M2605,Macrogenia
DRG48202,M2606,Microgenia
DRG48202,M2607,Excessive tuberosity of jaw
DRG48202,M2609,Other specified anomalies of jaw size
DRG48202,M2610,Unspecified anomaly of jaw-cranial base relationship
DRG48202,M2611,Maxillary asymmetry
DRG48202,M2612,Other jaw asymmetry
DRG48202,M2619,Other specified anomalies of jaw-cranial base relationship
DRG48202,M2620,Unspecified anomaly of dental arch relationship
DRG48202,M26211,"Malocclusion, Angle's class I"
DRG48202,M26212,"Malocclusion, Angle's class II"
DRG48202,M26213,"Malocclusion, Angle's class III"
DRG48202,M26219,"Malocclusion, Angle's class, unspecified"
DRG48202,M26220,Open anterior occlusal relationship
DRG48202,M26221,Open posterior occlusal relationship
DRG48202,M2623,Excessive horizontal overlap
DRG48202,M2624,Reverse articulation
DRG48202,M2625,Anomalies of interarch distance
DRG48202,M2629,Other anomalies of dental arch relationship
DRG48202,M2630,Unspecified anomaly of tooth position of fully erupted tooth or teeth
DRG48202,M2631,Crowding of fully erupted teeth
DRG48202,M2632,Excessive spacing of fully erupted teeth
DRG48202,M2633,Horizontal displacement of fully erupted tooth or teeth
DRG48202,M2634,Vertical displacement of fully erupted tooth or teeth
DRG48202,M2635,Rotation of fully erupted tooth or teeth
DRG48202,M2636,Insufficient interocclusal distance of fully erupted teeth (ridge)
DRG48202,M2637,Excessive interocclusal distance of fully erupted teeth
DRG48202,M2639,Other anomalies of tooth position of fully erupted tooth or teeth
DRG48202,M264,"Malocclusion, unspecified"
DRG48202,M2650,"Dentofacial functional abnormalities, unspecified"
DRG48202,M2651,Abnormal jaw closure
DRG48202,M2652,Limited mandibular range of motion
DRG48202,M2653,Deviation in opening and closing of the mandible
DRG48202,M2654,Insufficient anterior guidance
DRG48202,M2655,Centric occlusion maximum intercuspation discrepancy
DRG48202,M2656,Non-working side interference
DRG48202,M2657,Lack of posterior occlusal support
DRG48202,M2659,Other dentofacial functional abnormalities
DRG48202,M2660,"Temporomandibular joint disorder, unspecified"
DRG48202,M2661,Adhesions and ankylosis of temporomandibular joint
DRG48202,M2662,Arthralgia of temporomandibular joint
DRG48202,M2663,Articular disc disorder of temporomandibular joint
DRG48202,M2669,Other specified disorders of temporomandibular joint
DRG48202,M2670,Unspecified alveolar anomaly
DRG48202,M2671,Alveolar maxillary hyperplasia
DRG48202,M2672,Alveolar mandibular hyperplasia
DRG48202,M2673,Alveolar maxillary hypoplasia
DRG48202,M2674,Alveolar mandibular hypoplasia
DRG48202,M2679,Other specified alveolar anomalies
DRG48202,M2681,Anterior soft tissue impingement
DRG48202,M2682,Posterior soft tissue impingement
DRG48202,M2689,Other dentofacial anomalies
DRG48202,M269,"Dentofacial anomaly, unspecified"
DRG48202,M270,Developmental disorders of jaws
DRG48202,M271,"Giant cell granuloma, central"
DRG48202,M272,Inflammatory conditions of jaws
DRG48202,M273,Alveolitis of jaws
DRG48202,M2740,Unspecified cyst of jaw
DRG48202,M2749,Other cysts of jaw
DRG48202,M2751,Perforation of root canal space due to endodontic treatment
DRG48202,M2752,Endodontic overfill
DRG48202,M2753,Endodontic underfill
DRG48202,M2759,Other periradicular pathology associated with previous endodontic treatment
DRG48202,M2761,Osseointegration failure of dental implant
DRG48202,M2762,Post-osseointegration biological failure of dental implant
DRG48202,M2763,Post-osseointegration mechanical failure of dental implant
DRG48202,M2769,Other endosseous dental implant failure
DRG48202,M278,Other specified diseases of jaws
DRG48202,M279,"Disease of jaws, unspecified"
DRG48202,Q310,Web of larynx
DRG48202,Q311,Congenital subglottic stenosis
DRG48202,Q312,Laryngeal hypoplasia
DRG48202,Q313,Laryngocele
DRG48202,Q315,Congenital laryngomalacia
DRG48202,Q318,Other congenital malformations of larynx
DRG48202,Q319,"Congenital malformation of larynx, unspecified"
DRG48202,Q320,Congenital tracheomalacia
DRG48202,Q321,Other congenital malformations of trachea
DRG48202,Q322,Congenital bronchomalacia
DRG48202,Q323,Congenital stenosis of bronchus
DRG48202,Q324,Other congenital malformations of bronchus
DRG48202,Q351,Cleft hard palate
DRG48202,Q353,Cleft soft palate
DRG48202,Q355,Cleft hard palate with cleft soft palate
DRG48202,Q357,Cleft uvula
DRG48202,Q359,"Cleft palate, unspecified"
DRG48202,Q360,"Cleft lip, bilateral"
DRG48202,Q361,"Cleft lip, median"
DRG48202,Q369,"Cleft lip, unilateral"
DRG48202,Q370,Cleft hard palate with bilateral cleft lip
DRG48202,Q371,Cleft hard palate with unilateral cleft lip
DRG48202,Q372,Cleft soft palate with bilateral cleft lip
DRG48202,Q373,Cleft soft palate with unilateral cleft lip
DRG48202,Q374,Cleft hard and soft palate with bilateral cleft lip
DRG48202,Q375,Cleft hard and soft palate with unilateral cleft lip
DRG48202,Q378,Unspecified cleft palate with bilateral cleft lip
DRG48202,Q379,Unspecified cleft palate with unilateral cleft lip
DRG48202,Q380,"Congenital malformations of lips, not elsewhere classified"
DRG48202,Q381,Ankyloglossia
DRG48202,Q382,Macroglossia
DRG48202,Q383,Other congenital malformations of tongue
DRG48202,Q384,Congenital malformations of salivary glands and ducts
DRG48202,Q385,"Congenital malformations of palate, not elsewhere classified"
DRG48202,Q386,Other congenital malformations of mouth
DRG48202,Q387,Congenital pharyngeal pouch
DRG48202,Q388,Other congenital malformations of pharynx
DRG48202,R041,Hemorrhage from throat
DRG48202,R682,"Dry mouth, unspecified"
DRG48202,R6884,Jaw pain
DRG48202,S0120XA,"Unspecified open wound of nose, initial encounter"
DRG48202,S0121XA,"Laceration without foreign body of nose, initial encounter"
DRG48202,S0122XA,"Laceration with foreign body of nose, initial encounter"
DRG48202,S0123XA,"Puncture wound without foreign body of nose, initial encounter"
DRG48202,S0124XA,"Puncture wound with foreign body of nose, initial encounter"
DRG48202,S0125XA,"Open bite of nose, initial encounter"
DRG48202,S01401A,"Unspecified open wound of right cheek and temporomandibular area, initial encounter"
DRG48202,S01402A,"Unspecified open wound of left cheek and temporomandibular area, initial encounter"
DRG48202,S01409A,"Unspecified open wound of unspecified cheek and temporomandibular area, initial encounter"
DRG48202,S01411A,"Laceration without foreign body of right cheek and temporomandibular area, initial encounter"
DRG48202,S01412A,"Laceration without foreign body of left cheek and temporomandibular area, initial encounter"
DRG48202,S01419A,"Laceration without foreign body of unspecified cheek and temporomandibular area, initial encounter"
DRG48202,S01421A,"Laceration with foreign body of right cheek and temporomandibular area, initial encounter"
DRG48202,S01422A,"Laceration with foreign body of left cheek and temporomandibular area, initial encounter"
DRG48202,S01429A,"Laceration with foreign body of unspecified cheek and temporomandibular area, initial encounter"
DRG48202,S01431A,"Puncture wound without foreign body of right cheek and temporomandibular area, initial encounter"
DRG48202,S01432A,"Puncture wound without foreign body of left cheek and temporomandibular area, initial encounter"
DRG48202,S01439A,"Puncture wound without foreign body of unspecified cheek and temporomandibular area, initial encounter"
DRG48202,S01441A,"Puncture wound with foreign body of right cheek and temporomandibular area, initial encounter"
DRG48202,S01442A,"Puncture wound with foreign body of left cheek and temporomandibular area, initial encounter"
DRG48202,S01449A,"Puncture wound with foreign body of unspecified cheek and temporomandibular area, initial encounter"
DRG48202,S01451A,"Open bite of right cheek and temporomandibular area, initial encounter"
DRG48202,S01452A,"Open bite of left cheek and temporomandibular area, initial encounter"
DRG48202,S01459A,"Open bite of unspecified cheek and temporomandibular area, initial encounter"
DRG48202,S01501A,"Unspecified open wound of lip, initial encounter"
DRG48202,S01502A,"Unspecified open wound of oral cavity, initial encounter"
DRG48202,S01511A,"Laceration without foreign body of lip, initial encounter"
DRG48202,S01512A,"Laceration without foreign body of oral cavity, initial encounter"
DRG48202,S01521A,"Laceration with foreign body of lip, initial encounter"
DRG48202,S01522A,"Laceration with foreign body of oral cavity, initial encounter"
DRG48202,S01531A,"Puncture wound without foreign body of lip, initial encounter"
DRG48202,S01532A,"Puncture wound without foreign body of oral cavity, initial encounter"
DRG48202,S01541A,"Puncture wound with foreign body of lip, initial encounter"
