DRG,CM-PCS,en
DRG48201,A155,"Tuberculosis of larynx, trachea and bronchus"
DRG48201,A360,Pharyngeal diphtheria
DRG48201,A361,Nasopharyngeal diphtheria
DRG48201,A362,Laryngeal diphtheria
DRG48201,A3689,Other diphtheritic complications
DRG48201,A4852,Wound botulism
DRG48201,A545,Gonococcal pharyngitis
DRG48201,A564,Chlamydial infection of pharynx
DRG48201,A665,Gangosa
DRG48201,A690,Necrotizing ulcerative stomatitis
DRG48201,A691,Other Vincent's infections
DRG48201,B002,Herpesviral gingivostomatitis and pharyngotonsillitis
DRG48201,B085,Enteroviral vesicular pharyngitis
DRG48201,B370,Candidal stomatitis
DRG48201,B3783,Candidal cheilitis
DRG48201,D0000,"Carcinoma in situ of oral cavity, unspecified site"
DRG48201,D0001,Carcinoma in situ of labial mucosa and vermilion border
DRG48201,D0002,Carcinoma in situ of buccal mucosa
DRG48201,D0003,Carcinoma in situ of gingiva and edentulous alveolar ridge
DRG48201,D0004,Carcinoma in situ of soft palate
DRG48201,D0005,Carcinoma in situ of hard palate
DRG48201,D0006,Carcinoma in situ of floor of mouth
DRG48201,D0007,Carcinoma in situ of tongue
DRG48201,D0008,Carcinoma in situ of pharynx
DRG48201,D020,Carcinoma in situ of larynx
DRG48201,D100,Benign neoplasm of lip
DRG48201,D101,Benign neoplasm of tongue
DRG48201,D102,Benign neoplasm of floor of mouth
DRG48201,D1030,Benign neoplasm of unspecified part of mouth
DRG48201,D1039,Benign neoplasm of other parts of mouth
DRG48201,D104,Benign neoplasm of tonsil
DRG48201,D105,Benign neoplasm of other parts of oropharynx
DRG48201,D106,Benign neoplasm of nasopharynx
DRG48201,D107,Benign neoplasm of hypopharynx
DRG48201,D109,"Benign neoplasm of pharynx, unspecified"
DRG48201,D110,Benign neoplasm of parotid gland
DRG48201,D117,Benign neoplasm of other major salivary glands
DRG48201,D119,"Benign neoplasm of major salivary gland, unspecified"
DRG48201,D140,"Benign neoplasm of middle ear, nasal cavity and accessory sinuses"
DRG48201,D141,Benign neoplasm of larynx
DRG48201,D164,Benign neoplasm of bones of skull and face
DRG48201,D165,Benign neoplasm of lower jaw bone
DRG48201,D1800,Hemangioma unspecified site
DRG48201,D1801,Hemangioma of skin and subcutaneous tissue
DRG48201,D1809,Hemangioma of other sites
DRG48201,D34,Benign neoplasm of thyroid gland
DRG48201,E034,Atrophy of thyroid (acquired)
DRG48201,E041,Nontoxic single thyroid nodule
DRG48201,E0500,Thyrotoxicosis with diffuse goiter without thyrotoxic crisis or storm
DRG48201,E0501,Thyrotoxicosis with diffuse goiter with thyrotoxic crisis or storm
DRG48201,E0510,Thyrotoxicosis with toxic single thyroid nodule without thyrotoxic crisis or storm
DRG48201,E0511,Thyrotoxicosis with toxic single thyroid nodule with thyrotoxic crisis or storm
DRG48201,E0520,Thyrotoxicosis with toxic multinodular goiter without thyrotoxic crisis or storm
DRG48201,E0521,Thyrotoxicosis with toxic multinodular goiter with thyrotoxic crisis or storm
DRG48201,E0530,Thyrotoxicosis from ectopic thyroid tissue without thyrotoxic crisis or storm
DRG48201,E0531,Thyrotoxicosis from ectopic thyroid tissue with thyrotoxic crisis or storm
DRG48201,E0540,Thyrotoxicosis factitia without thyrotoxic crisis or storm
DRG48201,E0541,Thyrotoxicosis factitia with thyrotoxic crisis or storm
DRG48201,E0580,Other thyrotoxicosis without thyrotoxic crisis or storm
DRG48201,E0581,Other thyrotoxicosis with thyrotoxic crisis or storm
DRG48201,E0590,"Thyrotoxicosis, unspecified without thyrotoxic crisis or storm"
DRG48201,E0591,"Thyrotoxicosis, unspecified with thyrotoxic crisis or storm"
DRG48201,E060,Acute thyroiditis
DRG48201,E061,Subacute thyroiditis
DRG48201,E062,Chronic thyroiditis with transient thyrotoxicosis
DRG48201,E063,Autoimmune thyroiditis
DRG48201,E064,Drug-induced thyroiditis
DRG48201,E065,Other chronic thyroiditis
DRG48201,E069,"Thyroiditis, unspecified"
DRG48201,E0789,Other specified disorders of thyroid
DRG48201,E079,"Disorder of thyroid, unspecified"
DRG48201,J00,Acute nasopharyngitis [common cold]
DRG48201,J020,Streptococcal pharyngitis
DRG48201,J028,Acute pharyngitis due to other specified organisms
DRG48201,J029,"Acute pharyngitis, unspecified"
DRG48201,J0300,"Acute streptococcal tonsillitis, unspecified"
DRG48201,J0301,Acute recurrent streptococcal tonsillitis
DRG48201,J0380,Acute tonsillitis due to other specified organisms
DRG48201,J0381,Acute recurrent tonsillitis due to other specified organisms
DRG48201,J0390,"Acute tonsillitis, unspecified"
DRG48201,J0391,"Acute recurrent tonsillitis, unspecified"
DRG48201,J040,Acute laryngitis
DRG48201,J042,Acute laryngotracheitis
DRG48201,J0430,"Supraglottitis, unspecified, without obstruction"
DRG48201,J0431,"Supraglottitis, unspecified, with obstruction"
DRG48201,J050,Acute obstructive laryngitis [croup]
DRG48201,J0510,Acute epiglottitis without obstruction
DRG48201,J0511,Acute epiglottitis with obstruction
DRG48201,J060,Acute laryngopharyngitis
DRG48201,J069,"Acute upper respiratory infection, unspecified"
DRG48201,J311,Chronic nasopharyngitis
DRG48201,J312,Chronic pharyngitis
DRG48201,J342,Deviated nasal septum
DRG48201,J3501,Chronic tonsillitis
DRG48201,J3502,Chronic adenoiditis
DRG48201,J3503,Chronic tonsillitis and adenoiditis
DRG48201,J351,Hypertrophy of tonsils
DRG48201,J352,Hypertrophy of adenoids
DRG48201,J353,Hypertrophy of tonsils with hypertrophy of adenoids
DRG48201,J358,Other chronic diseases of tonsils and adenoids
DRG48201,J359,"Chronic disease of tonsils and adenoids, unspecified"
DRG48201,J36,Peritonsillar abscess
DRG48201,J370,Chronic laryngitis
DRG48201,J371,Chronic laryngotracheitis
DRG48201,J3800,"Paralysis of vocal cords and larynx, unspecified"
DRG48201,J3801,"Paralysis of vocal cords and larynx, unilateral"
DRG48201,J3802,"Paralysis of vocal cords and larynx, bilateral"
DRG48201,J381,Polyp of vocal cord and larynx
DRG48201,J382,Nodules of vocal cords
DRG48201,J383,Other diseases of vocal cords
DRG48201,J384,Edema of larynx
DRG48201,J385,Laryngeal spasm
DRG48201,J386,Stenosis of larynx
DRG48201,J387,Other diseases of larynx
DRG48201,J390,Retropharyngeal and parapharyngeal abscess
DRG48201,J391,Other abscess of pharynx
DRG48201,J392,Other diseases of pharynx
DRG48201,J393,"Upper respiratory tract hypersensitivity reaction, site unspecified"
DRG48201,J398,Other specified diseases of upper respiratory tract
DRG48201,J399,"Disease of upper respiratory tract, unspecified"
DRG48201,J45990,Exercise induced bronchospasm
DRG48201,J9500,Unspecified tracheostomy complication
DRG48201,J9501,Hemorrhage from tracheostomy stoma
DRG48201,J9502,Infection of tracheostomy stoma
DRG48201,J9503,Malfunction of tracheostomy stoma
DRG48201,J9504,Tracheo-esophageal fistula following tracheostomy
DRG48201,J9509,Other tracheostomy complication
DRG48201,J9801,Acute bronchospasm
DRG48201,J9809,"Other diseases of bronchus, not elsewhere classified"
DRG48201,K000,Anodontia
DRG48201,K001,Supernumerary teeth
DRG48201,K002,Abnormalities of size and form of teeth
DRG48201,K003,Mottled teeth
DRG48201,K004,Disturbances in tooth formation
DRG48201,K005,"Hereditary disturbances in tooth structure, not elsewhere classified"
DRG48201,K006,Disturbances in tooth eruption
DRG48201,K007,Teething syndrome
DRG48201,K008,Other disorders of tooth development
DRG48201,K009,"Disorder of tooth development, unspecified"
DRG48201,K010,Embedded teeth
DRG48201,K011,Impacted teeth
DRG48201,K023,Arrested dental caries
DRG48201,K0251,Dental caries on pit and fissure surface limited to enamel
DRG48201,K0252,Dental caries on pit and fissure surface penetrating into dentin
DRG48201,K0253,Dental caries on pit and fissure surface penetrating into pulp
DRG48201,K0261,Dental caries on smooth surface limited to enamel
DRG48201,K0262,Dental caries on smooth surface penetrating into dentin
DRG48201,K0263,Dental caries on smooth surface penetrating into pulp
DRG48201,K027,Dental root caries
DRG48201,K029,"Dental caries, unspecified"
DRG48201,K030,Excessive attrition of teeth
DRG48201,K031,Abrasion of teeth
DRG48201,K032,Erosion of teeth
DRG48201,K033,Pathological resorption of teeth
DRG48201,K034,Hypercementosis
DRG48201,K035,Ankylosis of teeth
DRG48201,K036,Deposits [accretions] on teeth
DRG48201,K037,Posteruptive color changes of dental hard tissues
DRG48201,K0389,Other specified diseases of hard tissues of teeth
DRG48201,K039,"Disease of hard tissues of teeth, unspecified"
DRG48201,K040,Pulpitis
DRG48201,K041,Necrosis of pulp
DRG48201,K042,Pulp degeneration
DRG48201,K043,Abnormal hard tissue formation in pulp
DRG48201,K044,Acute apical periodontitis of pulpal origin
DRG48201,K045,Chronic apical periodontitis
DRG48201,K046,Periapical abscess with sinus
DRG48201,K047,Periapical abscess without sinus
DRG48201,K048,Radicular cyst
DRG48201,K0490,Unspecified diseases of pulp and periapical tissues
DRG48201,K0499,Other diseases of pulp and periapical tissues
DRG48201,K0500,"Acute gingivitis, plaque induced"
DRG48201,K0501,"Acute gingivitis, non-plaque induced"
DRG48201,K0510,"Chronic gingivitis, plaque induced"
DRG48201,K0511,"Chronic gingivitis, non-plaque induced"
DRG48201,K0520,"Aggressive periodontitis, unspecified"
DRG48201,K0521,"Aggressive periodontitis, localized"
DRG48201,K0522,"Aggressive periodontitis, generalized"
DRG48201,K0530,"Chronic periodontitis, unspecified"
DRG48201,K0531,"Chronic periodontitis, localized"
DRG48201,K0532,"Chronic periodontitis, generalized"
DRG48201,K054,Periodontosis
DRG48201,K055,Other periodontal diseases
DRG48201,K056,"Periodontal disease, unspecified"
DRG48201,K060,Gingival recession
DRG48201,K061,Gingival enlargement
DRG48201,K062,Gingival and edentulous alveolar ridge lesions associated with trauma
DRG48201,K068,Other specified disorders of gingiva and edentulous alveolar ridge
DRG48201,K069,"Disorder of gingiva and edentulous alveolar ridge, unspecified"
DRG48201,K080,Exfoliation of teeth due to systemic causes
DRG48201,K08101,"Complete loss of teeth, unspecified cause, class I"
DRG48201,K08102,"Complete loss of teeth, unspecified cause, class II"
DRG48201,K08103,"Complete loss of teeth, unspecified cause, class III"
DRG48201,K08104,"Complete loss of teeth, unspecified cause, class IV"
DRG48201,K08109,"Complete loss of teeth, unspecified cause, unspecified class"
DRG48201,K08111,"Complete loss of teeth due to trauma, class I"
DRG48201,K08112,"Complete loss of teeth due to trauma, class II"
DRG48201,K08113,"Complete loss of teeth due to trauma, class III"
DRG48201,K08114,"Complete loss of teeth due to trauma, class IV"
DRG48201,K08119,"Complete loss of teeth due to trauma, unspecified class"
DRG48201,K08121,"Complete loss of teeth due to periodontal diseases, class I"
DRG48201,K08122,"Complete loss of teeth due to periodontal diseases, class II"
DRG48201,K08123,"Complete loss of teeth due to periodontal diseases, class III"
DRG48201,K08124,"Complete loss of teeth due to periodontal diseases, class IV"
DRG48201,K08129,"Complete loss of teeth due to periodontal diseases, unspecified class"
DRG48201,K08131,"Complete loss of teeth due to caries, class I"
DRG48201,K08132,"Complete loss of teeth due to caries, class II"
DRG48201,K08133,"Complete loss of teeth due to caries, class III"
DRG48201,K08134,"Complete loss of teeth due to caries, class IV"
DRG48201,K08139,"Complete loss of teeth due to caries, unspecified class"
DRG48201,K08191,"Complete loss of teeth due to other specified cause, class I"
DRG48201,K08192,"Complete loss of teeth due to other specified cause, class II"
DRG48201,K08193,"Complete loss of teeth due to other specified cause, class III"
DRG48201,K08194,"Complete loss of teeth due to other specified cause, class IV"
DRG48201,K08199,"Complete loss of teeth due to other specified cause, unspecified class"
DRG48201,K0820,Unspecified atrophy of edentulous alveolar ridge
DRG48201,K0821,Minimal atrophy of the mandible
DRG48201,K0822,Moderate atrophy of the mandible
DRG48201,K0823,Severe atrophy of the mandible
DRG48201,K0824,Minimal atrophy of maxilla
DRG48201,K0825,Moderate atrophy of the maxilla
DRG48201,K0826,Severe atrophy of the maxilla
DRG48201,K083,Retained dental root
DRG48201,K08401,"Partial loss of teeth, unspecified cause, class I"
DRG48201,K08402,"Partial loss of teeth, unspecified cause, class II"
DRG48201,K08403,"Partial loss of teeth, unspecified cause, class III"
DRG48201,K08404,"Partial loss of teeth, unspecified cause, class IV"
DRG48201,K08409,"Partial loss of teeth, unspecified cause, unspecified class"
DRG48201,K08411,"Partial loss of teeth due to trauma, class I"
DRG48201,K08412,"Partial loss of teeth due to trauma, class II"
DRG48201,K08413,"Partial loss of teeth due to trauma, class III"
DRG48201,K08414,"Partial loss of teeth due to trauma, class IV"
DRG48201,K08419,"Partial loss of teeth due to trauma, unspecified class"
DRG48201,K08421,"Partial loss of teeth due to periodontal diseases, class I"
DRG48201,K08422,"Partial loss of teeth due to periodontal diseases, class II"
DRG48201,K08423,"Partial loss of teeth due to periodontal diseases, class III"
DRG48201,K08424,"Partial loss of teeth due to periodontal diseases, class IV"
DRG48201,K08429,"Partial loss of teeth due to periodontal diseases, unspecified class"
DRG48201,K08431,"Partial loss of teeth due to caries, class I"
DRG48201,K08432,"Partial loss of teeth due to caries, class II"
DRG48201,K08433,"Partial loss of teeth due to caries, class III"
DRG48201,K08434,"Partial loss of teeth due to caries, class IV"
DRG48201,K08439,"Partial loss of teeth due to caries, unspecified class"
DRG48201,K08491,"Partial loss of teeth due to other specified cause, class I"
DRG48201,K08492,"Partial loss of teeth due to other specified cause, class II"
DRG48201,K08493,"Partial loss of teeth due to other specified cause, class III"
DRG48201,K08494,"Partial loss of teeth due to other specified cause, class IV"
DRG48201,K08499,"Partial loss of teeth due to other specified cause, unspecified class"
DRG48201,K0850,"Unsatisfactory restoration of tooth, unspecified"
DRG48201,K0851,Open restoration margins of tooth
DRG48201,K0852,Unrepairable overhanging of dental restorative materials
DRG48201,K08530,Fractured dental restorative material without loss of material
DRG48201,K08531,Fractured dental restorative material with loss of material
DRG48201,K08539,"Fractured dental restorative material, unspecified"
DRG48201,K0854,Contour of existing restoration of tooth biologically incompatible with oral health
DRG48201,K0855,Allergy to existing dental restorative material
DRG48201,K0856,Poor aesthetic of existing restoration of tooth
DRG48201,K0859,Other unsatisfactory restoration of tooth
DRG48201,K088,Other specified disorders of teeth and supporting structures
DRG48201,K089,"Disorder of teeth and supporting structures, unspecified"
DRG48201,K090,Developmental odontogenic cysts
DRG48201,K091,Developmental (nonodontogenic) cysts of oral region
DRG48201,K098,"Other cysts of oral region, not elsewhere classified"
DRG48201,K099,"Cyst of oral region, unspecified"
DRG48201,K110,Atrophy of salivary gland
DRG48201,K111,Hypertrophy of salivary gland
DRG48201,K1120,"Sialoadenitis, unspecified"
DRG48201,K1121,Acute sialoadenitis
DRG48201,K1122,Acute recurrent sialoadenitis
DRG48201,K1123,Chronic sialoadenitis
DRG48201,K113,Abscess of salivary gland
DRG48201,K114,Fistula of salivary gland
DRG48201,K115,Sialolithiasis
DRG48201,K116,Mucocele of salivary gland
DRG48201,K117,Disturbances of salivary secretion
DRG48201,K118,Other diseases of salivary glands
DRG48201,K119,"Disease of salivary gland, unspecified"
DRG48201,K120,Recurrent oral aphthae
DRG48201,K121,Other forms of stomatitis
DRG48201,K122,Cellulitis and abscess of mouth
DRG48201,K1230,"Oral mucositis (ulcerative), unspecified"
DRG48201,K1231,Oral mucositis (ulcerative) due to antineoplastic therapy
DRG48201,K1232,Oral mucositis (ulcerative) due to other drugs
DRG48201,K1233,Oral mucositis (ulcerative) due to radiation
DRG48201,K1239,Other oral mucositis (ulcerative)
DRG48201,K130,Diseases of lips
DRG48201,K131,Cheek and lip biting
DRG48201,K1321,"Leukoplakia of oral mucosa, including tongue"
DRG48201,K1322,Minimal keratinized residual ridge mucosa
DRG48201,K1323,Excessive keratinized residual ridge mucosa
DRG48201,K1324,Leukokeratosis nicotina palati
DRG48201,K1329,"Other disturbances of oral epithelium, including tongue"
DRG48201,K133,Hairy leukoplakia
DRG48201,K134,Granuloma and granuloma-like lesions of oral mucosa
DRG48201,K135,Oral submucous fibrosis
DRG48201,K136,Irritative hyperplasia of oral mucosa
DRG48201,K1370,Unspecified lesions of oral mucosa
DRG48201,K1379,Other lesions of oral mucosa
DRG48201,K140,Glossitis
DRG48201,K141,Geographic tongue
DRG48201,K142,Median rhomboid glossitis
DRG48201,K143,Hypertrophy of tongue papillae
DRG48201,K144,Atrophy of tongue papillae
DRG48201,K145,Plicated tongue
DRG48201,K146,Glossodynia
DRG48201,K148,Other diseases of tongue
DRG48201,K149,"Disease of tongue, unspecified"
DRG48201,L0201,Cutaneous abscess of face
DRG48201,L0211,Cutaneous abscess of neck
DRG48201,L03211,Cellulitis of face
DRG48201,L03212,Acute lymphangitis of face
DRG48201,L03221,Cellulitis of neck
DRG48201,L03222,Acute lymphangitis of neck
DRG48201,M2600,Unspecified anomaly of jaw size
DRG48201,M2601,Maxillary hyperplasia
DRG48201,M2602,Maxillary hypoplasia
DRG48201,M2603,Mandibular hyperplasia
DRG48201,M2604,Mandibular hypoplasia
DRG48201,M2605,Macrogenia
DRG48201,M2606,Microgenia
DRG48201,M2607,Excessive tuberosity of jaw
DRG48201,M2609,Other specified anomalies of jaw size
DRG48201,M2610,Unspecified anomaly of jaw-cranial base relationship
DRG48201,M2611,Maxillary asymmetry
DRG48201,M2612,Other jaw asymmetry
DRG48201,M2619,Other specified anomalies of jaw-cranial base relationship
DRG48201,M2620,Unspecified anomaly of dental arch relationship
DRG48201,M26211,"Malocclusion, Angle's class I"
DRG48201,M26212,"Malocclusion, Angle's class II"
DRG48201,M26213,"Malocclusion, Angle's class III"
DRG48201,M26219,"Malocclusion, Angle's class, unspecified"
DRG48201,M26220,Open anterior occlusal relationship
DRG48201,M26221,Open posterior occlusal relationship
DRG48201,M2623,Excessive horizontal overlap
DRG48201,M2624,Reverse articulation
DRG48201,M2625,Anomalies of interarch distance
DRG48201,M2629,Other anomalies of dental arch relationship
DRG48201,M2630,Unspecified anomaly of tooth position of fully erupted tooth or teeth
DRG48201,M2631,Crowding of fully erupted teeth
DRG48201,M2632,Excessive spacing of fully erupted teeth
DRG48201,M2633,Horizontal displacement of fully erupted tooth or teeth
DRG48201,M2634,Vertical displacement of fully erupted tooth or teeth
DRG48201,M2635,Rotation of fully erupted tooth or teeth
DRG48201,M2636,Insufficient interocclusal distance of fully erupted teeth (ridge)
DRG48201,M2637,Excessive interocclusal distance of fully erupted teeth
DRG48201,M2639,Other anomalies of tooth position of fully erupted tooth or teeth
DRG48201,M264,"Malocclusion, unspecified"
DRG48201,M2650,"Dentofacial functional abnormalities, unspecified"
DRG48201,M2651,Abnormal jaw closure
DRG48201,M2652,Limited mandibular range of motion
DRG48201,M2653,Deviation in opening and closing of the mandible
DRG48201,M2654,Insufficient anterior guidance
DRG48201,M2655,Centric occlusion maximum intercuspation discrepancy
DRG48201,M2656,Non-working side interference
DRG48201,M2657,Lack of posterior occlusal support
DRG48201,M2659,Other dentofacial functional abnormalities
DRG48201,M2660,"Temporomandibular joint disorder, unspecified"
DRG48201,M2661,Adhesions and ankylosis of temporomandibular joint
DRG48201,M2662,Arthralgia of temporomandibular joint
DRG48201,M2663,Articular disc disorder of temporomandibular joint
DRG48201,M2669,Other specified disorders of temporomandibular joint
DRG48201,M2670,Unspecified alveolar anomaly
DRG48201,M2671,Alveolar maxillary hyperplasia
DRG48201,M2672,Alveolar mandibular hyperplasia
DRG48201,M2673,Alveolar maxillary hypoplasia
DRG48201,M2674,Alveolar mandibular hypoplasia
DRG48201,M2679,Other specified alveolar anomalies
DRG48201,M2681,Anterior soft tissue impingement
DRG48201,M2682,Posterior soft tissue impingement
DRG48201,M2689,Other dentofacial anomalies
DRG48201,M269,"Dentofacial anomaly, unspecified"
DRG48201,M270,Developmental disorders of jaws
DRG48201,M271,"Giant cell granuloma, central"
DRG48201,M272,Inflammatory conditions of jaws
DRG48201,M273,Alveolitis of jaws
DRG48201,M2740,Unspecified cyst of jaw
DRG48201,M2749,Other cysts of jaw
DRG48201,M2751,Perforation of root canal space due to endodontic treatment
DRG48201,M2752,Endodontic overfill
DRG48201,M2753,Endodontic underfill
DRG48201,M2759,Other periradicular pathology associated with previous endodontic treatment
DRG48201,M2761,Osseointegration failure of dental implant
DRG48201,M2762,Post-osseointegration biological failure of dental implant
DRG48201,M2763,Post-osseointegration mechanical failure of dental implant
DRG48201,M2769,Other endosseous dental implant failure
DRG48201,M278,Other specified diseases of jaws
DRG48201,M279,"Disease of jaws, unspecified"
DRG48201,Q310,Web of larynx
DRG48201,Q311,Congenital subglottic stenosis
DRG48201,Q312,Laryngeal hypoplasia
DRG48201,Q313,Laryngocele
DRG48201,Q315,Congenital laryngomalacia
DRG48201,Q318,Other congenital malformations of larynx
DRG48201,Q319,"Congenital malformation of larynx, unspecified"
DRG48201,Q320,Congenital tracheomalacia
DRG48201,Q321,Other congenital malformations of trachea
DRG48201,Q322,Congenital bronchomalacia
DRG48201,Q323,Congenital stenosis of bronchus
DRG48201,Q324,Other congenital malformations of bronchus
DRG48201,Q351,Cleft hard palate
DRG48201,Q353,Cleft soft palate
DRG48201,Q355,Cleft hard palate with cleft soft palate
DRG48201,Q357,Cleft uvula
DRG48201,Q359,"Cleft palate, unspecified"
DRG48201,Q360,"Cleft lip, bilateral"
DRG48201,Q361,"Cleft lip, median"
DRG48201,Q369,"Cleft lip, unilateral"
DRG48201,Q370,Cleft hard palate with bilateral cleft lip
DRG48201,Q371,Cleft hard palate with unilateral cleft lip
DRG48201,Q372,Cleft soft palate with bilateral cleft lip
DRG48201,Q373,Cleft soft palate with unilateral cleft lip
DRG48201,Q374,Cleft hard and soft palate with bilateral cleft lip
DRG48201,Q375,Cleft hard and soft palate with unilateral cleft lip
DRG48201,Q378,Unspecified cleft palate with bilateral cleft lip
DRG48201,Q379,Unspecified cleft palate with unilateral cleft lip
DRG48201,Q380,"Congenital malformations of lips, not elsewhere classified"
DRG48201,Q381,Ankyloglossia
DRG48201,Q382,Macroglossia
DRG48201,Q383,Other congenital malformations of tongue
DRG48201,Q384,Congenital malformations of salivary glands and ducts
DRG48201,Q385,"Congenital malformations of palate, not elsewhere classified"
DRG48201,Q386,Other congenital malformations of mouth
DRG48201,Q387,Congenital pharyngeal pouch
DRG48201,Q388,Other congenital malformations of pharynx
DRG48201,R041,Hemorrhage from throat
DRG48201,R682,"Dry mouth, unspecified"
DRG48201,R6884,Jaw pain
DRG48201,S0120XA,"Unspecified open wound of nose, initial encounter"
DRG48201,S0121XA,"Laceration without foreign body of nose, initial encounter"
DRG48201,S0122XA,"Laceration with foreign body of nose, initial encounter"
DRG48201,S0123XA,"Puncture wound without foreign body of nose, initial encounter"
DRG48201,S0124XA,"Puncture wound with foreign body of nose, initial encounter"
DRG48201,S0125XA,"Open bite of nose, initial encounter"
DRG48201,S01401A,"Unspecified open wound of right cheek and temporomandibular area, initial encounter"
DRG48201,S01402A,"Unspecified open wound of left cheek and temporomandibular area, initial encounter"
DRG48201,S01409A,"Unspecified open wound of unspecified cheek and temporomandibular area, initial encounter"
DRG48201,S01411A,"Laceration without foreign body of right cheek and temporomandibular area, initial encounter"
DRG48201,S01412A,"Laceration without foreign body of left cheek and temporomandibular area, initial encounter"
DRG48201,S01419A,"Laceration without foreign body of unspecified cheek and temporomandibular area, initial encounter"
DRG48201,S01421A,"Laceration with foreign body of right cheek and temporomandibular area, initial encounter"
DRG48201,S01422A,"Laceration with foreign body of left cheek and temporomandibular area, initial encounter"
DRG48201,S01429A,"Laceration with foreign body of unspecified cheek and temporomandibular area, initial encounter"
DRG48201,S01431A,"Puncture wound without foreign body of right cheek and temporomandibular area, initial encounter"
DRG48201,S01432A,"Puncture wound without foreign body of left cheek and temporomandibular area, initial encounter"
DRG48201,S01439A,"Puncture wound without foreign body of unspecified cheek and temporomandibular area, initial encounter"
DRG48201,S01441A,"Puncture wound with foreign body of right cheek and temporomandibular area, initial encounter"
DRG48201,S01442A,"Puncture wound with foreign body of left cheek and temporomandibular area, initial encounter"
DRG48201,S01449A,"Puncture wound with foreign body of unspecified cheek and temporomandibular area, initial encounter"
DRG48201,S01451A,"Open bite of right cheek and temporomandibular area, initial encounter"
DRG48201,S01452A,"Open bite of left cheek and temporomandibular area, initial encounter"
DRG48201,S01459A,"Open bite of unspecified cheek and temporomandibular area, initial encounter"
DRG48201,S01501A,"Unspecified open wound of lip, initial encounter"
DRG48201,S01502A,"Unspecified open wound of oral cavity, initial encounter"
DRG48201,S01511A,"Laceration without foreign body of lip, initial encounter"
DRG48201,S01512A,"Laceration without foreign body of oral cavity, initial encounter"
DRG48201,S01521A,"Laceration with foreign body of lip, initial encounter"
DRG48201,S01522A,"Laceration with foreign body of oral cavity, initial encounter"
DRG48201,S01531A,"Puncture wound without foreign body of lip, initial encounter"
DRG48201,S01532A,"Puncture wound without foreign body of oral cavity, initial encounter"
DRG48201,S01541A,"Puncture wound with foreign body of lip, initial encounter"
