DRG30201	腎移植，有合併症或併發症
DRG30202	腎移植，無合併症或併發症
DRG30301	腎、輸尿管及膀胱良性腫瘤手術，有合併症或併發症
DRG30302	腎、輸尿管及膀胱良性腫瘤手術，無合併症或併發症
DRG30303	腎、輸尿管及膀胱原位癌手術，有合併症或併發症 
DRG30304	腎、輸尿管及膀胱原位癌手術，無合併症或併發症 
DRG304	腎、輸尿管及膀胱非惡性腫瘤手術，有合併症或併發症
DRG305	腎、輸尿管及膀胱非惡性腫瘤手術，無合併症或併發症
DRG306	攝護腺切除術，有合併症或併發症
DRG307	攝護腺切除術，無合併症或併發症
DRG308	膀胱小手術，有合併症或併發症
DRG309	膀胱小手術，無合併症或併發症
DRG31001	雙側或多發性尿路結石手術，有複雜次診斷
DRG31002	雙側或多發性尿路結石手術，無複雜次診斷，有合併症或併發症
DRG31102	雙側或多發性尿路結石手術，無複雜次診斷，無合併症或併發症
DRG31003	鹿角性結石或巨大腎結石手術，有複雜次診斷
DRG31004	鹿角性結石或巨大腎結石手術，無複雜次診斷，有合併症或併發症
DRG31104	鹿角性結石或巨大腎結石手術，無複雜次診斷，無合併症或併發症
DRG31005	其他尿路結石手術，有合併症或併發症
DRG31105	其他尿路結石手術，無合併症或併發症
DRG31006	其他經由尿道之手術，有體外震波碎石術，有合併症或併發症
DRG31106	其他經由尿道之手術，有體外震波碎石術，無合併症或併發症
DRG31007	其他經由尿道之手術，無體外震波碎石術，有合併症或併發症
DRG31107	其他經由尿道之手術，無體外震波碎石術，無合併症或併發症
DRG31201	尿道下裂、上裂手術，年齡大於等於18歲，有合併症或併發症
DRG31301	尿道下裂、上裂手術，年齡大於等於18歲，無合併症或併發症
DRG31401	尿道下裂、上裂手術，年齡0-17歲
DRG31202	其他尿道手術，年齡大於等於18歲，有合併症或併發症
DRG31302	其他尿道手術，年齡大於等於18歲，無合併症或併發症
DRG31402	其他尿道手術，年齡0-17歲
DRG31501	其他腎及尿道手術，有合併症或併發症
DRG31502	其他腎及尿道手術，無合併症或併發症
DRG31605	腎衰竭，洗腎及洗腎導管置入術，年齡>=18歲，有合併症或併發症
DRG31606	腎衰竭，洗腎及洗腎導管置入術，年齡>=18歲，無合併症或併發症
DRG31607	腎衰竭，洗腎及洗腎導管置入術，年齡0-17歲
DRG31601	腎衰竭，洗腎，無洗腎導管置入術，年齡>=18歲，有合併症或併發症
DRG31602	腎衰竭，洗腎，無洗腎導管置入術，年齡>=18歲，無合併症或併發症
DRG31608	腎衰竭，洗腎，無洗腎導管置入術，年齡0-17歲
DRG31603	腎衰竭，無洗腎，有合併症或併發症
DRG31604	腎衰竭，無洗腎，無合併症或併發症
DRG317	住診血液透析
DRG318	腎及泌尿道腫瘤，有合併症或併發症
DRG319	腎及泌尿道腫瘤，無合併症或併發症
DRG320	腎及泌尿道感染，年齡大於等於18歲，有合併症或併發症
DRG321	腎及泌尿道感染，年齡大於等於18歲，無合併症或併發症
DRG32203	腎及泌尿道感染(1)，年齡0-17歲，有合併症或併發症
DRG32204	腎及泌尿道感染(1)，年齡0-17歲，無合併症或併發症
DRG32201	腎及泌尿道感染(2)，年齡0-17歲，有合併症或併發症
DRG32202	腎及泌尿道感染(2)，年齡0-17歲，無合併症或併發症
DRG32301	尿道結石，有體外震波碎石術治療(1)，有合併症或併發症
DRG32401	尿道結石，有體外震波碎石術治療(1)，無合併症或併發症
DRG32302	尿道結石，無體外震波碎石術治療(2)，有合併症或併發症
DRG32402	尿道結石，無體外震波碎石術治療(2)，無合併症或併發症
DRG325	腎及泌尿道症狀及徵候，年齡大於等於18歲，有合併症或併發症
DRG326	腎及泌尿道症狀及徵候，年齡大於等於18歲，無合併症或併發症
DRG32701	腎及泌尿道症狀及徵候，年齡0-17歲，有合併症或併發症
DRG32702	腎及泌尿道症狀及徵候，年齡0-17歲，無合併症或併發症
DRG328	尿道狹窄，年齡大於等於18歲，有合併症或併發症
DRG329	尿道狹窄，年齡大於等於18歲，無合併症或併發症
DRG33001	尿道狹窄，年齡0-17歲，有合併症或併發症
DRG33002	尿道狹窄，年齡0-17歲，無合併症或併發症
DRG33101	急性腎絲球腎炎，年齡大於等於18歲，有合併症或併發症
DRG33201	急性腎絲球腎炎，年齡大於等於18歲，無合併症或併發症
DRG33301	急性腎絲球腎炎，年齡0-17歲，有合併症或併發症
DRG33302	急性腎絲球腎炎，年齡0-17歲，無合併症或併發症
DRG33102	腎病徵候群，年齡大於等於18歲，有合併症或併發症
DRG33202	腎病徵候群，年齡大於等於18歲，無合併症或併發症
DRG33303	腎病徵候群，年齡0-17歲，有合併症或併發症
DRG33304	腎病徵候群，年齡0-17歲，無合併症或併發症
DRG33103	慢性腎絲球腎炎，年齡大於等於18歲，有合併症或併發症
DRG33203	慢性腎絲球腎炎，年齡大於等於18歲，無合併症或併發症
DRG33305	慢性腎絲球腎炎，年齡0-17歲，有合併症或併發症
DRG33306	慢性腎絲球腎炎，年齡0-17歲，無合併症或併發症
DRG33104	其他腎炎及腎病變，年齡大於等於18歲，有合併症或併發症
DRG33204	其他腎炎及腎病變，年齡大於等於18歲，無合併症或併發症
DRG33307	其他腎炎及腎病變，年齡0-17歲，有合併症或併發症
DRG33308	其他腎炎及腎病變，年齡0-17歲，無合併症或併發症
DRG33105	先天性腎疾患，年齡大於等於18歲，有合併症或併發症
DRG33205	先天性腎疾患，年齡大於等於18歲，無合併症或併發症
DRG33309	先天性腎疾患，年齡0-17歲，有合併症或併發症
DRG33310	先天性腎疾患，年齡0-17歲，無合併症或併發症
DRG33106	捐腎，年齡大於等於18歲，有合併症或併發症
DRG33206	捐腎，年齡大於等於18歲，無合併症或併發症
DRG33311	捐腎，年齡0-17歲，有合併症或併發症
DRG33312	捐腎，年齡0-17歲，無合併症或併發症
DRG33107	其他腎及泌尿道診斷，年齡大於等於18歲，有合併症或併發症
DRG33207	其他腎及泌尿道診斷，年齡大於等於18歲，無合併症或併發症
DRG33313	其他腎及泌尿道診斷，年齡0-17歲，有合併症或併發症
DRG33314	其他腎及泌尿道診斷，年齡0-17歲，無合併症或併發症
