DRG,CM-PCS,en
N11,P0508,"Newborn light for gestational age, 2000-2499 grams"
N11,P0518,"Newborn small for gestational age, 2000-2499 grams"
N11,P0718,"Other low birth weight newborn, 2000-2499 grams"
N11,5A09357,"Assistance with Respiratory Ventilation, Less than 24 Consecutive Hours, Continuous Positive Airway Pressure"
N11,5A09457,"Assistance with Respiratory Ventilation, 24-96 Consecutive Hours, Continuous Positive Airway Pressure"
N11,5A09557,"Assistance with Respiratory Ventilation, Greater than 96 Consecutive Hours, Continuous Positive Airway Pressure"
N11,5A1935Z,"Respiratory Ventilation, Less than 24 Consecutive Hours"
N11,5A1945Z,"Respiratory Ventilation, 24-96 Consecutive Hours"
N11,5A1955Z,"Respiratory Ventilation, Greater than 96 Consecutive Hours"
